[INFO] Loading metadata from file /home/cicero/O2Tutorial_2025/AO2D.root in PID 275238
[INFO] No metadata found in file "/home/cicero/O2Tutorial_2025/AO2D.root" and parent level 0 prevents further lookup.
[INFO] Initialising O2 Data Processing Layer. Driver PID: 275238.
[INFO] Driver listening on port: 13318
[INFO] Rate limiting set up at 500 MB and 1 timeframes distributed over 1 readers
[INFO] O2 Data Processing Layer initialised. We brake for nobody.
[INFO] Optimised build. O2DEBUG / LOG(debug) / LOGF(debug) / assert statement will not be shown.
[INFO] Redeployment of configuration asked.
[INFO] Starting internal-dpl-clock on pid 275247
[INFO] Starting internal-dpl-aod-reader on pid 275248
[INFO] Starting strangeness_derived_tutorial on pid 275249
[INFO] Starting internal-dpl-aod-global-analysis-file-sink on pid 275250
[INFO] Starting internal-dpl-injected-dummy-sink on pid 275251
[INFO] Redeployment of configuration done.
[275248:internal-dpl-aod-reader]: [INFO] Instrumenting crash signals
[275248:internal-dpl-aod-reader]: [INFO] Spawning new device internal-dpl-aod-reader in process with pid 275248
[275248:internal-dpl-aod-reader]: [10:49:30][INFO] 
[275248:internal-dpl-aod-reader]:       ______      _    _______  _________ 
[275248:internal-dpl-aod-reader]:      / ____/___ _(_)_______   |/  /_  __ \    version 1.10.0
[275248:internal-dpl-aod-reader]:     / /_  / __ `/ / ___/__  /|_/ /_  / / /    build RELWITHDEBINFO
[275248:internal-dpl-aod-reader]:    / __/ / /_/ / / /    _  /  / / / /_/ /     https://github.com/FairRootGroup/FairMQ
[275248:internal-dpl-aod-reader]:   /_/    \__,_/_/_/     /_/  /_/  \___\_\     LGPL-3.0  © 2012-2025 GSI
[275248:internal-dpl-aod-reader]: 
[275248:internal-dpl-aod-reader]: [10:49:30][STATE] Starting FairMQ state machine --> IDLE
[275250:internal-dpl-aod-global-analysis-file-sink]: [INFO] Instrumenting crash signals
[275247:internal-dpl-clock]: [INFO] Instrumenting crash signals
[275248:internal-dpl-aod-reader]: [10:49:30][STATE] IDLE ---> INITIALIZING DEVICE
[275250:internal-dpl-aod-global-analysis-file-sink]: [INFO] Spawning new device internal-dpl-aod-global-analysis-file-sink in process with pid 275250
[275247:internal-dpl-clock]: [INFO] Spawning new device internal-dpl-clock in process with pid 275247
[275250:internal-dpl-aod-global-analysis-file-sink]: [10:49:30][INFO] 
[275250:internal-dpl-aod-global-analysis-file-sink]:       ______      _    _______  _________ 
[275250:internal-dpl-aod-global-analysis-file-sink]:      / ____/___ _(_)_______   |/  /_  __ \    version 1.10.0
[275250:internal-dpl-aod-global-analysis-file-sink]:     / /_  / __ `/ / ___/__  /|_/ /_  / / /    build RELWITHDEBINFO
[275250:internal-dpl-aod-global-analysis-file-sink]:    / __/ / /_/ / / /    _  /  / / / /_/ /     https://github.com/FairRootGroup/FairMQ
[275250:internal-dpl-aod-global-analysis-file-sink]:   /_/    \__,_/_/_/     /_/  /_/  \___\_\     LGPL-3.0  © 2012-2025 GSI
[275250:internal-dpl-aod-global-analysis-file-sink]: 
[275247:internal-dpl-clock]: [10:49:30][INFO] 
[275247:internal-dpl-clock]:       ______      _    _______  _________ 
[275247:internal-dpl-clock]:      / ____/___ _(_)_______   |/  /_  __ \    version 1.10.0
[275247:internal-dpl-clock]:     / /_  / __ `/ / ___/__  /|_/ /_  / / /    build RELWITHDEBINFO
[275247:internal-dpl-clock]:    / __/ / /_/ / / /    _  /  / / / /_/ /     https://github.com/FairRootGroup/FairMQ
[275247:internal-dpl-clock]:   /_/    \__,_/_/_/     /_/  /_/  \___\_\     LGPL-3.0  © 2012-2025 GSI
[275247:internal-dpl-clock]: 
[275250:internal-dpl-aod-global-analysis-file-sink]: [10:49:30][STATE] Starting FairMQ state machine --> IDLE
[275247:internal-dpl-clock]: [10:49:30][STATE] Starting FairMQ state machine --> IDLE
[275249:strangeness_derived_tutorial]: [INFO] Instrumenting crash signals
[275249:strangeness_derived_tutorial]: [INFO] Spawning new device strangeness_derived_tutorial in process with pid 275249
[275249:strangeness_derived_tutorial]: [10:49:30][INFO] 
[275249:strangeness_derived_tutorial]:       ______      _    _______  _________ 
[275249:strangeness_derived_tutorial]:      / ____/___ _(_)_______   |/  /_  __ \    version 1.10.0
[275249:strangeness_derived_tutorial]:     / /_  / __ `/ / ___/__  /|_/ /_  / / /    build RELWITHDEBINFO
[275249:strangeness_derived_tutorial]:    / __/ / /_/ / / /    _  /  / / / /_/ /     https://github.com/FairRootGroup/FairMQ
[275249:strangeness_derived_tutorial]:   /_/    \__,_/_/_/     /_/  /_/  \___\_\     LGPL-3.0  © 2012-2025 GSI
[275249:strangeness_derived_tutorial]: 
[275249:strangeness_derived_tutorial]: [10:49:30][STATE] Starting FairMQ state machine --> IDLE
[275250:internal-dpl-aod-global-analysis-file-sink]: [10:49:30][STATE] IDLE ---> INITIALIZING DEVICE
[275247:internal-dpl-clock]: [10:49:30][STATE] IDLE ---> INITIALIZING DEVICE
[275251:internal-dpl-injected-dummy-sink]: [INFO] Instrumenting crash signals
[275250:internal-dpl-aod-global-analysis-file-sink]: [10:49:30][STATE] INITIALIZING DEVICE ---> INITIALIZED
[275250:internal-dpl-aod-global-analysis-file-sink]: [10:49:30][STATE] INITIALIZED ---> BINDING
[275250:internal-dpl-aod-global-analysis-file-sink]: [10:49:30][STATE] BINDING ---> BOUND
[275247:internal-dpl-clock]: [10:49:30][STATE] INITIALIZING DEVICE ---> INITIALIZED
[275250:internal-dpl-aod-global-analysis-file-sink]: [10:49:30][STATE] BOUND ---> CONNECTING
[275247:internal-dpl-clock]: [10:49:30][STATE] INITIALIZED ---> BINDING
[275250:internal-dpl-aod-global-analysis-file-sink]: [10:49:30][STATE] CONNECTING ---> DEVICE READY
[275250:internal-dpl-aod-global-analysis-file-sink]: [10:49:30][STATE] DEVICE READY ---> INITIALIZING TASK
[275247:internal-dpl-clock]: [10:49:30][STATE] BINDING ---> BOUND
[275247:internal-dpl-clock]: [10:49:30][STATE] BOUND ---> CONNECTING
[275247:internal-dpl-clock]: [10:49:30][STATE] CONNECTING ---> DEVICE READY
[275250:internal-dpl-aod-global-analysis-file-sink]: [10:49:30][STATE] INITIALIZING TASK ---> READY
[275247:internal-dpl-clock]: [10:49:30][STATE] DEVICE READY ---> INITIALIZING TASK
[275250:internal-dpl-aod-global-analysis-file-sink]: [10:49:30][STATE] READY ---> RUNNING
[275250:internal-dpl-aod-global-analysis-file-sink]: [10:49:30][INFO] fair::mq::Device running...
[275250:internal-dpl-aod-global-analysis-file-sink]: [10:49:30][INFO] LHCPeriod is not available, using current month NOV
[275247:internal-dpl-clock]: [10:49:30][STATE] INITIALIZING TASK ---> READY
[275247:internal-dpl-clock]: [10:49:30][STATE] READY ---> RUNNING
[275247:internal-dpl-clock]: [10:49:30][INFO] fair::mq::Device running...
[275247:internal-dpl-clock]: [10:49:30][INFO] LHCPeriod is not available, using current month NOV
[275250:internal-dpl-aod-global-analysis-file-sink]: [10:49:30][INFO] Correctly handshaken websocket connection.
[INFO] Controller for internal-dpl-aod-reader not yet available.
[275247:internal-dpl-clock]: [10:49:30][INFO] Correctly handshaken websocket connection.
[275249:strangeness_derived_tutorial]: [10:49:30][STATE] IDLE ---> INITIALIZING DEVICE
[275251:internal-dpl-injected-dummy-sink]: [INFO] Spawning new device internal-dpl-injected-dummy-sink in process with pid 275251
[275251:internal-dpl-injected-dummy-sink]: [10:49:30][INFO] 
[275251:internal-dpl-injected-dummy-sink]:       ______      _    _______  _________ 
[275251:internal-dpl-injected-dummy-sink]:      / ____/___ _(_)_______   |/  /_  __ \    version 1.10.0
[275251:internal-dpl-injected-dummy-sink]:     / /_  / __ `/ / ___/__  /|_/ /_  / / /    build RELWITHDEBINFO
[275251:internal-dpl-injected-dummy-sink]:    / __/ / /_/ / / /    _  /  / / / /_/ /     https://github.com/FairRootGroup/FairMQ
[275251:internal-dpl-injected-dummy-sink]:   /_/    \__,_/_/_/     /_/  /_/  \___\_\     LGPL-3.0  © 2012-2025 GSI
[275251:internal-dpl-injected-dummy-sink]: 
[275251:internal-dpl-injected-dummy-sink]: [10:49:30][STATE] Starting FairMQ state machine --> IDLE
[275248:internal-dpl-aod-reader]: [10:49:30][STATE] INITIALIZING DEVICE ---> INITIALIZED
[275248:internal-dpl-aod-reader]: [10:49:30][STATE] INITIALIZED ---> BINDING
[275249:strangeness_derived_tutorial]: [10:49:30][STATE] INITIALIZING DEVICE ---> INITIALIZED
[275249:strangeness_derived_tutorial]: [10:49:30][STATE] INITIALIZED ---> BINDING
[275248:internal-dpl-aod-reader]: [10:49:30][STATE] BINDING ---> BOUND
[275248:internal-dpl-aod-reader]: [10:49:30][STATE] BOUND ---> CONNECTING
[275248:internal-dpl-aod-reader]: [10:49:30][STATE] CONNECTING ---> DEVICE READY
[275248:internal-dpl-aod-reader]: [10:49:30][STATE] DEVICE READY ---> INITIALIZING TASK
[275249:strangeness_derived_tutorial]: [10:49:30][STATE] BINDING ---> BOUND
[275249:strangeness_derived_tutorial]: [10:49:30][STATE] BOUND ---> CONNECTING
[275248:internal-dpl-aod-reader]: [10:49:30][STATE] INITIALIZING TASK ---> READY
[275248:internal-dpl-aod-reader]: [10:49:30][STATE] READY ---> RUNNING
[275248:internal-dpl-aod-reader]: [10:49:30][INFO] fair::mq::Device running...
[275248:internal-dpl-aod-reader]: [10:49:30][INFO] LHCPeriod is not available, using current month NOV
[275249:strangeness_derived_tutorial]: [10:49:30][STATE] CONNECTING ---> DEVICE READY
[275249:strangeness_derived_tutorial]: [10:49:30][STATE] DEVICE READY ---> INITIALIZING TASK
[INFO] Controller for internal-dpl-aod-reader now available.
[275248:internal-dpl-aod-reader]: [10:49:30][WARN] Not enough resources to schedule computation. 0 skipped so far. Last scheduled at 0.
[275248:internal-dpl-aod-reader]: [10:49:30][WARN] Not enough resources to schedule computation. 1 skipped so far. Last scheduled at 0.
[275248:internal-dpl-aod-reader]: [10:49:30][INFO] Correctly handshaken websocket connection.
[275248:internal-dpl-aod-reader]: [10:49:30][WARN] Not enough resources to schedule computation. 2 skipped so far. Last scheduled at 0.
[275248:internal-dpl-aod-reader]: [10:49:30][WARN] Not enough resources to schedule computation. 3 skipped so far. Last scheduled at 0.
[275248:internal-dpl-aod-reader]: [10:49:30][WARN] Not enough resources to schedule computation. 4 skipped so far. Last scheduled at 0.
[275249:strangeness_derived_tutorial]: [10:49:30][STATE] INITIALIZING TASK ---> READY
[275249:strangeness_derived_tutorial]: [10:49:30][STATE] READY ---> RUNNING
[275249:strangeness_derived_tutorial]: [10:49:30][INFO] fair::mq::Device running...
[275249:strangeness_derived_tutorial]: [10:49:30][INFO] LHCPeriod is not available, using current month NOV
[275249:strangeness_derived_tutorial]: [10:49:30][INFO] Correctly handshaken websocket connection.
[275251:internal-dpl-injected-dummy-sink]: [10:49:30][STATE] IDLE ---> INITIALIZING DEVICE
[275251:internal-dpl-injected-dummy-sink]: [10:49:30][STATE] INITIALIZING DEVICE ---> INITIALIZED
[275251:internal-dpl-injected-dummy-sink]: [10:49:30][STATE] INITIALIZED ---> BINDING
[275251:internal-dpl-injected-dummy-sink]: [10:49:30][STATE] BINDING ---> BOUND
[275251:internal-dpl-injected-dummy-sink]: [10:49:30][STATE] BOUND ---> CONNECTING
[275251:internal-dpl-injected-dummy-sink]: [10:49:30][STATE] CONNECTING ---> DEVICE READY
[275251:internal-dpl-injected-dummy-sink]: [10:49:30][STATE] DEVICE READY ---> INITIALIZING TASK
[275251:internal-dpl-injected-dummy-sink]: [10:49:30][STATE] INITIALIZING TASK ---> READY
[275251:internal-dpl-injected-dummy-sink]: [10:49:30][STATE] READY ---> RUNNING
[275251:internal-dpl-injected-dummy-sink]: [10:49:30][INFO] fair::mq::Device running...
[275251:internal-dpl-injected-dummy-sink]: [10:49:30][INFO] LHCPeriod is not available, using current month NOV
[275251:internal-dpl-injected-dummy-sink]: [10:49:30][INFO] Correctly handshaken websocket connection.
[275248:internal-dpl-aod-reader]: [10:49:30][INFO] Opening file: lfn=/home/cicero/O2Tutorial_2025/AO2D.root,size=57000273
[275251:internal-dpl-injected-dummy-sink]: [10:49:30][INFO] Domain info updated with timeslice 1
[275249:strangeness_derived_tutorial]: /home/cicero/alice/sw/BUILD/5d32fd791cd718ddf7c99fb922a432d5ce9676f3/arrow/src_tmp/cpp/src/gandiva/cache.cc:58: Creating gandiva cache with capacity of 5000
[275249:strangeness_derived_tutorial]: /home/cicero/alice/sw/BUILD/5d32fd791cd718ddf7c99fb922a432d5ce9676f3/arrow/src_tmp/cpp/src/gandiva/engine.cc:282: Detected CPU Name : znver2
[275249:strangeness_derived_tutorial]: /home/cicero/alice/sw/BUILD/5d32fd791cd718ddf7c99fb922a432d5ce9676f3/arrow/src_tmp/cpp/src/gandiva/engine.cc:283: Detected CPU Features: [ +prfchw -cldemote +avx +aes +sahf +pclmul -xop +crc32 -amx-fp8 +xsaves -avx512fp16 -usermsr -sm4 -egpr +sse4.1 -avx512ifma +xsave +sse4.2 -tsxldtrk -sm3 -ptwrite -widekl -movrs -invpcid +64bit +xsavec -avx10.1-512 -avx512vpopcntdq +cmov -avx512vp2intersect -avx512cd +movbe -avxvnniint8 -ccmp -amx-int8 -kl -avx10.1-256 -sha512 -avxvnni -rtm +adx +avx2 -hreset -movdiri -serialize -vpclmulqdq -avx512vl -uintr -cf +clflushopt -raoint -cmpccxadd +bmi -amx-tile +sse -avx10.2-256 -gfni -avxvnniint16 -amx-fp16 -zu -ndd +xsaveopt +rdrnd -avx512f -amx-bf16 -avx512bf16 -avx512vnni -push2pop2 +cx8 -avx512bw +sse3 -pku -nf -amx-tf32 -amx-avx512 +fsgsbase +clzero +mwaitx -lwp +lzcnt +sha -movdir64b -ppx +wbnoinvd -enqcmd -amx-transpose -avx10.2-512 -avxneconvert -tbm -pconfig -amx-complex +ssse3 +cx16 +bmi2 +fma +popcnt -avxifma +f16c -avx512bitalg +rdpru +clwb +mmx +sse2 +rdseed -avx512vbmi2 -prefetchi -amx-movrs +rdpid -fma4 -avx512vbmi -shstk -vaes -waitpkg -sgx +fxsr -avx512dq +sse4a]
[275251:internal-dpl-injected-dummy-sink]: [10:49:30][INFO] Domain info updated with timeslice 2
[275251:internal-dpl-injected-dummy-sink]: [10:49:30][INFO] Domain info updated with timeslice 3
[275251:internal-dpl-injected-dummy-sink]: [10:49:30][INFO] Domain info updated with timeslice 4
[275251:internal-dpl-injected-dummy-sink]: [10:49:30][INFO] Domain info updated with timeslice 5
[275251:internal-dpl-injected-dummy-sink]: [10:49:30][INFO] Domain info updated with timeslice 6
[275251:internal-dpl-injected-dummy-sink]: [10:49:30][INFO] Domain info updated with timeslice 7
[275251:internal-dpl-injected-dummy-sink]: [10:49:30][INFO] Domain info updated with timeslice 8
[275251:internal-dpl-injected-dummy-sink]: [10:49:30][INFO] Domain info updated with timeslice 9
[275251:internal-dpl-injected-dummy-sink]: [10:49:30][INFO] Domain info updated with timeslice 10
[275251:internal-dpl-injected-dummy-sink]: [10:49:30][INFO] Domain info updated with timeslice 11
[275251:internal-dpl-injected-dummy-sink]: [10:49:30][INFO] Domain info updated with timeslice 12
[275251:internal-dpl-injected-dummy-sink]: [10:49:30][INFO] Domain info updated with timeslice 13
[275251:internal-dpl-injected-dummy-sink]: [10:49:30][INFO] Domain info updated with timeslice 14
[275251:internal-dpl-injected-dummy-sink]: [10:49:30][INFO] Domain info updated with timeslice 15
[275251:internal-dpl-injected-dummy-sink]: [10:49:30][INFO] Domain info updated with timeslice 16
[275251:internal-dpl-injected-dummy-sink]: [10:49:30][INFO] Domain info updated with timeslice 17
[275251:internal-dpl-injected-dummy-sink]: [10:49:30][INFO] Domain info updated with timeslice 18
[275251:internal-dpl-injected-dummy-sink]: [10:49:30][INFO] Domain info updated with timeslice 19
[275251:internal-dpl-injected-dummy-sink]: [10:49:30][INFO] Domain info updated with timeslice 20
[275251:internal-dpl-injected-dummy-sink]: [10:49:30][INFO] Domain info updated with timeslice 21
[275251:internal-dpl-injected-dummy-sink]: [10:49:30][INFO] Domain info updated with timeslice 22
[275251:internal-dpl-injected-dummy-sink]: [10:49:30][INFO] Domain info updated with timeslice 23
[275251:internal-dpl-injected-dummy-sink]: [10:49:30][INFO] Domain info updated with timeslice 24
[275251:internal-dpl-injected-dummy-sink]: [10:49:30][INFO] Domain info updated with timeslice 25
[275251:internal-dpl-injected-dummy-sink]: [10:49:31][INFO] Domain info updated with timeslice 26
[275251:internal-dpl-injected-dummy-sink]: [10:49:31][INFO] Domain info updated with timeslice 27
[275251:internal-dpl-injected-dummy-sink]: [10:49:31][INFO] Domain info updated with timeslice 28
[275251:internal-dpl-injected-dummy-sink]: [10:49:31][INFO] Domain info updated with timeslice 29
[275251:internal-dpl-injected-dummy-sink]: [10:49:31][INFO] Domain info updated with timeslice 30
[275251:internal-dpl-injected-dummy-sink]: [10:49:31][INFO] Domain info updated with timeslice 31
[275251:internal-dpl-injected-dummy-sink]: [10:49:31][INFO] Domain info updated with timeslice 32
[275251:internal-dpl-injected-dummy-sink]: [10:49:31][INFO] Domain info updated with timeslice 33
[275251:internal-dpl-injected-dummy-sink]: [10:49:31][INFO] Domain info updated with timeslice 34
[275251:internal-dpl-injected-dummy-sink]: [10:49:31][INFO] Domain info updated with timeslice 35
[275251:internal-dpl-injected-dummy-sink]: [10:49:31][INFO] Domain info updated with timeslice 36
[275251:internal-dpl-injected-dummy-sink]: [10:49:31][INFO] Domain info updated with timeslice 37
[275251:internal-dpl-injected-dummy-sink]: [10:49:31][INFO] Domain info updated with timeslice 38
[275251:internal-dpl-injected-dummy-sink]: [10:49:31][INFO] Domain info updated with timeslice 39
[275251:internal-dpl-injected-dummy-sink]: [10:49:31][INFO] Domain info updated with timeslice 40
[275251:internal-dpl-injected-dummy-sink]: [10:49:31][INFO] Domain info updated with timeslice 41
[275251:internal-dpl-injected-dummy-sink]: [10:49:31][INFO] Domain info updated with timeslice 42
[275251:internal-dpl-injected-dummy-sink]: [10:49:31][INFO] Domain info updated with timeslice 43
[275251:internal-dpl-injected-dummy-sink]: [10:49:31][INFO] Domain info updated with timeslice 44
[275251:internal-dpl-injected-dummy-sink]: [10:49:31][INFO] Domain info updated with timeslice 45
[275251:internal-dpl-injected-dummy-sink]: [10:49:31][INFO] Domain info updated with timeslice 46
[275251:internal-dpl-injected-dummy-sink]: [10:49:31][INFO] Domain info updated with timeslice 47
[275251:internal-dpl-injected-dummy-sink]: [10:49:31][INFO] Domain info updated with timeslice 48
[275251:internal-dpl-injected-dummy-sink]: [10:49:31][INFO] Domain info updated with timeslice 49
[275251:internal-dpl-injected-dummy-sink]: [10:49:31][INFO] Domain info updated with timeslice 50
[275251:internal-dpl-injected-dummy-sink]: [10:49:31][INFO] Domain info updated with timeslice 51
[275251:internal-dpl-injected-dummy-sink]: [10:49:31][INFO] Domain info updated with timeslice 52
[275251:internal-dpl-injected-dummy-sink]: [10:49:31][INFO] Domain info updated with timeslice 53
[275251:internal-dpl-injected-dummy-sink]: [10:49:31][INFO] Domain info updated with timeslice 54
[275251:internal-dpl-injected-dummy-sink]: [10:49:31][INFO] Domain info updated with timeslice 55
[275251:internal-dpl-injected-dummy-sink]: [10:49:31][INFO] Domain info updated with timeslice 56
[275251:internal-dpl-injected-dummy-sink]: [10:49:31][INFO] Domain info updated with timeslice 57
[275251:internal-dpl-injected-dummy-sink]: [10:49:31][INFO] Domain info updated with timeslice 58
[275251:internal-dpl-injected-dummy-sink]: [10:49:31][INFO] Domain info updated with timeslice 59
[275251:internal-dpl-injected-dummy-sink]: [10:49:31][INFO] Domain info updated with timeslice 60
[275251:internal-dpl-injected-dummy-sink]: [10:49:31][INFO] Domain info updated with timeslice 61
[275251:internal-dpl-injected-dummy-sink]: [10:49:31][INFO] Domain info updated with timeslice 62
[275251:internal-dpl-injected-dummy-sink]: [10:49:31][INFO] Domain info updated with timeslice 63
[275251:internal-dpl-injected-dummy-sink]: [10:49:31][INFO] Domain info updated with timeslice 64
[275251:internal-dpl-injected-dummy-sink]: [10:49:31][INFO] Domain info updated with timeslice 65
[275251:internal-dpl-injected-dummy-sink]: [10:49:31][INFO] Domain info updated with timeslice 66
[275251:internal-dpl-injected-dummy-sink]: [10:49:31][INFO] Domain info updated with timeslice 67
[275251:internal-dpl-injected-dummy-sink]: [10:49:31][INFO] Domain info updated with timeslice 68
[275251:internal-dpl-injected-dummy-sink]: [10:49:31][INFO] Domain info updated with timeslice 69
[275251:internal-dpl-injected-dummy-sink]: [10:49:31][INFO] Domain info updated with timeslice 70
[275251:internal-dpl-injected-dummy-sink]: [10:49:31][INFO] Domain info updated with timeslice 71
[275251:internal-dpl-injected-dummy-sink]: [10:49:31][INFO] Domain info updated with timeslice 72
[275251:internal-dpl-injected-dummy-sink]: [10:49:31][INFO] Domain info updated with timeslice 73
[275251:internal-dpl-injected-dummy-sink]: [10:49:31][INFO] Domain info updated with timeslice 74
[275251:internal-dpl-injected-dummy-sink]: [10:49:31][INFO] Domain info updated with timeslice 75
[275251:internal-dpl-injected-dummy-sink]: [10:49:31][INFO] Domain info updated with timeslice 76
[275251:internal-dpl-injected-dummy-sink]: [10:49:31][INFO] Domain info updated with timeslice 77
[275251:internal-dpl-injected-dummy-sink]: [10:49:31][INFO] Domain info updated with timeslice 78
[275251:internal-dpl-injected-dummy-sink]: [10:49:31][INFO] Domain info updated with timeslice 79
[275251:internal-dpl-injected-dummy-sink]: [10:49:31][INFO] Domain info updated with timeslice 80
[275251:internal-dpl-injected-dummy-sink]: [10:49:31][INFO] Domain info updated with timeslice 81
[275251:internal-dpl-injected-dummy-sink]: [10:49:31][INFO] Domain info updated with timeslice 82
[275251:internal-dpl-injected-dummy-sink]: [10:49:31][INFO] Domain info updated with timeslice 83
[275251:internal-dpl-injected-dummy-sink]: [10:49:31][INFO] Domain info updated with timeslice 84
[275251:internal-dpl-injected-dummy-sink]: [10:49:31][INFO] Domain info updated with timeslice 85
[275251:internal-dpl-injected-dummy-sink]: [10:49:31][INFO] Domain info updated with timeslice 86
[275251:internal-dpl-injected-dummy-sink]: [10:49:31][INFO] Domain info updated with timeslice 87
[275251:internal-dpl-injected-dummy-sink]: [10:49:31][INFO] Domain info updated with timeslice 88
[275251:internal-dpl-injected-dummy-sink]: [10:49:31][INFO] Domain info updated with timeslice 89
[275251:internal-dpl-injected-dummy-sink]: [10:49:31][INFO] Domain info updated with timeslice 90
[275251:internal-dpl-injected-dummy-sink]: [10:49:31][INFO] Domain info updated with timeslice 91
[275251:internal-dpl-injected-dummy-sink]: [10:49:31][INFO] Domain info updated with timeslice 92
[275251:internal-dpl-injected-dummy-sink]: [10:49:31][INFO] Domain info updated with timeslice 93
[275251:internal-dpl-injected-dummy-sink]: [10:49:31][INFO] Domain info updated with timeslice 94
[275251:internal-dpl-injected-dummy-sink]: [10:49:31][INFO] Domain info updated with timeslice 95
[275251:internal-dpl-injected-dummy-sink]: [10:49:31][INFO] Domain info updated with timeslice 96
[275251:internal-dpl-injected-dummy-sink]: [10:49:31][INFO] Domain info updated with timeslice 97
[275251:internal-dpl-injected-dummy-sink]: [10:49:31][INFO] Domain info updated with timeslice 98
[275251:internal-dpl-injected-dummy-sink]: [10:49:31][INFO] Domain info updated with timeslice 99
[275251:internal-dpl-injected-dummy-sink]: [10:49:31][INFO] Domain info updated with timeslice 100
[275248:internal-dpl-aod-reader]: [10:49:31][INFO] No input files left to read for reader 0!
[275248:internal-dpl-aod-reader]: [10:49:31][INFO] Read info: lfn=/home/cicero/O2Tutorial_2025/AO2D.root,size=57000273,total_df=100,read_df=100,read_bytes=10362981,read_calls=904,io_time=0.4,wait_time=0.1,level=0
[275248:internal-dpl-aod-reader]: [10:49:31][INFO] Sending end-of-stream message to channel from_internal-dpl-aod-reader_to_strangeness_derived_tutorial
[275248:internal-dpl-aod-reader]: [10:49:31][INFO] Sending end-of-stream message to channel from_internal-dpl-aod-reader_to_internal-dpl-injected-dummy-sink
[275251:internal-dpl-injected-dummy-sink]: [10:49:31][INFO] Domain info updated with timeslice 101
[275249:strangeness_derived_tutorial]: [10:49:31][INFO] Sending end-of-stream message to channel from_strangeness_derived_tutorial_to_internal-dpl-aod-global-analysis-file-sink
[INFO] Quitting
[INFO] Quit requested at Wed Nov 12 10:49:31 2025

[275248:internal-dpl-aod-reader]: [10:49:31][INFO] Received device shutdown request (signal 15).
[275248:internal-dpl-aod-reader]: [10:49:31][INFO] Waiting for graceful device shutdown. Hit Ctrl-C again to abort immediately.
[275248:internal-dpl-aod-reader]: [10:49:31][INFO] New state requested. No timeout set, quitting immediately as per --completion-policy
[275248:internal-dpl-aod-reader]: [10:49:31][STATE] RUNNING ---> READY
[275248:internal-dpl-aod-reader]: [10:49:31][STATE] READY ---> RESETTING TASK
[275248:internal-dpl-aod-reader]: [10:49:31][STATE] RESETTING TASK ---> DEVICE READY
[275248:internal-dpl-aod-reader]: [10:49:31][STATE] DEVICE READY ---> RESETTING DEVICE
[275248:internal-dpl-aod-reader]: [10:49:31][STATE] RESETTING DEVICE ---> IDLE
[275248:internal-dpl-aod-reader]: [10:49:31][STATE] IDLE ---> EXITING
[275248:internal-dpl-aod-reader]: [10:49:31][STATE] Exiting FairMQ state machine
[275247:internal-dpl-clock]: [10:49:31][INFO] Received device shutdown request (signal 15).
[275247:internal-dpl-clock]: [10:49:31][INFO] Waiting for graceful device shutdown. Hit Ctrl-C again to abort immediately.
[275250:internal-dpl-aod-global-analysis-file-sink]: [10:49:31][INFO] Received device shutdown request (signal 15).
[275250:internal-dpl-aod-global-analysis-file-sink]: [10:49:31][INFO] Waiting for graceful device shutdown. Hit Ctrl-C again to abort immediately.
[275247:internal-dpl-clock]: [10:49:31][INFO] New state requested. No timeout set, quitting immediately as per --completion-policy
[275250:internal-dpl-aod-global-analysis-file-sink]: [10:49:31][INFO] New state requested. No timeout set, quitting immediately as per --completion-policy
[275250:internal-dpl-aod-global-analysis-file-sink]: [10:49:31][STATE] RUNNING ---> READY
[275250:internal-dpl-aod-global-analysis-file-sink]: [10:49:31][STATE] READY ---> RESETTING TASK
[275250:internal-dpl-aod-global-analysis-file-sink]: [10:49:31][STATE] RESETTING TASK ---> DEVICE READY
[275250:internal-dpl-aod-global-analysis-file-sink]: [10:49:31][STATE] DEVICE READY ---> RESETTING DEVICE
[275250:internal-dpl-aod-global-analysis-file-sink]: [10:49:31][STATE] RESETTING DEVICE ---> IDLE
[275250:internal-dpl-aod-global-analysis-file-sink]: [10:49:31][STATE] IDLE ---> EXITING
[275250:internal-dpl-aod-global-analysis-file-sink]: [10:49:31][STATE] Exiting FairMQ state machine
[275249:strangeness_derived_tutorial]: [10:49:31][INFO] Received device shutdown request (signal 15).
[275249:strangeness_derived_tutorial]: [10:49:31][INFO] Waiting for graceful device shutdown. Hit Ctrl-C again to abort immediately.
[275249:strangeness_derived_tutorial]: [10:49:31][INFO] New state requested. No timeout set, quitting immediately as per --completion-policy
[275249:strangeness_derived_tutorial]: [10:49:31][STATE] RUNNING ---> READY
[275249:strangeness_derived_tutorial]: [10:49:31][STATE] READY ---> RESETTING TASK
[275249:strangeness_derived_tutorial]: [10:49:31][STATE] RESETTING TASK ---> DEVICE READY
[275249:strangeness_derived_tutorial]: [10:49:31][STATE] DEVICE READY ---> RESETTING DEVICE
[275249:strangeness_derived_tutorial]: [10:49:31][STATE] RESETTING DEVICE ---> IDLE
[275249:strangeness_derived_tutorial]: [10:49:31][STATE] IDLE ---> EXITING
[275249:strangeness_derived_tutorial]: [10:49:31][STATE] Exiting FairMQ state machine
[275251:internal-dpl-injected-dummy-sink]: [10:49:31][INFO] Received device shutdown request (signal 15).
[275251:internal-dpl-injected-dummy-sink]: [10:49:31][INFO] Waiting for graceful device shutdown. Hit Ctrl-C again to abort immediately.
[275251:internal-dpl-injected-dummy-sink]: [10:49:31][INFO] New state requested. No timeout set, quitting immediately as per --completion-policy
[275251:internal-dpl-injected-dummy-sink]: [10:49:31][STATE] RUNNING ---> READY
[275251:internal-dpl-injected-dummy-sink]: [10:49:31][STATE] READY ---> RESETTING TASK
[275251:internal-dpl-injected-dummy-sink]: [10:49:31][STATE] RESETTING TASK ---> DEVICE READY
[275251:internal-dpl-injected-dummy-sink]: [10:49:31][STATE] DEVICE READY ---> RESETTING DEVICE
[275251:internal-dpl-injected-dummy-sink]: [10:49:31][STATE] RESETTING DEVICE ---> IDLE
[275251:internal-dpl-injected-dummy-sink]: [10:49:31][STATE] IDLE ---> EXITING
[275251:internal-dpl-injected-dummy-sink]: [10:49:31][STATE] Exiting FairMQ state machine
[275247:internal-dpl-clock]: [10:49:31][INFO] Sending end-of-stream message to channel from_internal-dpl-clock_to_internal-dpl-aod-reader
[275247:internal-dpl-clock]: [10:49:31][STATE] RUNNING ---> READY
[275247:internal-dpl-clock]: [10:49:31][STATE] READY ---> RESETTING TASK
[275247:internal-dpl-clock]: [10:49:31][STATE] RESETTING TASK ---> DEVICE READY
[275247:internal-dpl-clock]: [10:49:31][STATE] DEVICE READY ---> RESETTING DEVICE
[275247:internal-dpl-clock]: [10:49:31][INFO] Cleaning up for shared memory id 'bcdac347'...
[275247:internal-dpl-clock]: [10:49:31][INFO] Found 0 unmanaged regions...
[275247:internal-dpl-clock]: [10:49:31][INFO] Found 1 managed segments...
[275247:internal-dpl-clock]: [10:49:31][INFO] Successfully removed 'fmq_bcdac347_m_0'.
[275247:internal-dpl-clock]: [10:49:31][INFO] Successfully removed 'fmq_bcdac347_mng'.
[275247:internal-dpl-clock]: [10:49:31][STATE] RESETTING DEVICE ---> IDLE
[275247:internal-dpl-clock]: [10:49:31][STATE] IDLE ---> EXITING
[275247:internal-dpl-clock]: [10:49:31][STATE] Exiting FairMQ state machine
[INFO] ## Processes completed. Run summary:
[INFO] ### Devices started: 5
[INFO]  - Device internal-dpl-clock: pid 275247 (exit 0)
[INFO]  - Device internal-dpl-aod-reader: pid 275248 (exit 0)
[INFO]  - Device strangeness_derived_tutorial: pid 275249 (exit 0)
[INFO]  - Device internal-dpl-aod-global-analysis-file-sink: pid 275250 (exit 0)
[INFO]  - Device internal-dpl-injected-dummy-sink: pid 275251 (exit 0)
[INFO] ## Analysis Run Summary ##
[INFO] ### Files read stats ###
[INFO] lfn=/home/cicero/O2Tutorial_2025/AO2D.root,size=57000273,total_df=100,read_df=100,read_bytes=10362981,read_calls=904,io_time=0.4,wait_time=0.1,level=0
[INFO] ### Files opened stats ###
[INFO] Last file opened: lfn=/home/cicero/O2Tutorial_2025/AO2D.root,size=57000273
[INFO] Dumping used configuration in dpl-config.json
