[INFO] Loading metadata from file /home/cicero/O2Tutorial_2025/AO2D.root in PID 275075
[INFO] No metadata found in file "/home/cicero/O2Tutorial_2025/AO2D.root" and parent level 0 prevents further lookup.
[INFO] Initialising O2 Data Processing Layer. Driver PID: 275075.
[INFO] Driver listening on port: 13155
[INFO] Rate limiting set up at 500 MB and 1 timeframes distributed over 1 readers
[INFO] O2 Data Processing Layer initialised. We brake for nobody.
[INFO] Optimised build. O2DEBUG / LOG(debug) / LOGF(debug) / assert statement will not be shown.
[INFO] Redeployment of configuration asked.
[INFO] Starting internal-dpl-clock on pid 275084
[INFO] Starting internal-dpl-aod-reader on pid 275085
[INFO] Starting strangeness_derived_tutorial on pid 275086
[INFO] Starting internal-dpl-aod-global-analysis-file-sink on pid 275087
[INFO] Starting internal-dpl-injected-dummy-sink on pid 275088
[INFO] Redeployment of configuration done.
[275084:internal-dpl-clock]: [INFO] Instrumenting crash signals
[275085:internal-dpl-aod-reader]: [INFO] Instrumenting crash signals
[275086:strangeness_derived_tutorial]: [INFO] Instrumenting crash signals
[275084:internal-dpl-clock]: [INFO] Spawning new device internal-dpl-clock in process with pid 275084
[275085:internal-dpl-aod-reader]: [INFO] Spawning new device internal-dpl-aod-reader in process with pid 275085
[275086:strangeness_derived_tutorial]: [INFO] Spawning new device strangeness_derived_tutorial in process with pid 275086
[275087:internal-dpl-aod-global-analysis-file-sink]: [INFO] Instrumenting crash signals
[275084:internal-dpl-clock]: [10:48:55][INFO] 
[275084:internal-dpl-clock]:       ______      _    _______  _________ 
[275084:internal-dpl-clock]:      / ____/___ _(_)_______   |/  /_  __ \    version 1.10.0
[275084:internal-dpl-clock]:     / /_  / __ `/ / ___/__  /|_/ /_  / / /    build RELWITHDEBINFO
[275084:internal-dpl-clock]:    / __/ / /_/ / / /    _  /  / / / /_/ /     https://github.com/FairRootGroup/FairMQ
[275084:internal-dpl-clock]:   /_/    \__,_/_/_/     /_/  /_/  \___\_\     LGPL-3.0  © 2012-2025 GSI
[275084:internal-dpl-clock]: 
[275086:strangeness_derived_tutorial]: [10:48:55][INFO] 
[275086:strangeness_derived_tutorial]:       ______      _    _______  _________ 
[275086:strangeness_derived_tutorial]:      / ____/___ _(_)_______   |/  /_  __ \    version 1.10.0
[275086:strangeness_derived_tutorial]:     / /_  / __ `/ / ___/__  /|_/ /_  / / /    build RELWITHDEBINFO
[275086:strangeness_derived_tutorial]:    / __/ / /_/ / / /    _  /  / / / /_/ /     https://github.com/FairRootGroup/FairMQ
[275086:strangeness_derived_tutorial]:   /_/    \__,_/_/_/     /_/  /_/  \___\_\     LGPL-3.0  © 2012-2025 GSI
[275086:strangeness_derived_tutorial]: 
[275085:internal-dpl-aod-reader]: [10:48:55][INFO] 
[275085:internal-dpl-aod-reader]:       ______      _    _______  _________ 
[275085:internal-dpl-aod-reader]:      / ____/___ _(_)_______   |/  /_  __ \    version 1.10.0
[275085:internal-dpl-aod-reader]:     / /_  / __ `/ / ___/__  /|_/ /_  / / /    build RELWITHDEBINFO
[275085:internal-dpl-aod-reader]:    / __/ / /_/ / / /    _  /  / / / /_/ /     https://github.com/FairRootGroup/FairMQ
[275085:internal-dpl-aod-reader]:   /_/    \__,_/_/_/     /_/  /_/  \___\_\     LGPL-3.0  © 2012-2025 GSI
[275085:internal-dpl-aod-reader]: 
[275084:internal-dpl-clock]: [10:48:55][STATE] Starting FairMQ state machine --> IDLE
[275085:internal-dpl-aod-reader]: [10:48:55][STATE] Starting FairMQ state machine --> IDLE
[275086:strangeness_derived_tutorial]: [10:48:55][STATE] Starting FairMQ state machine --> IDLE
[275087:internal-dpl-aod-global-analysis-file-sink]: [INFO] Spawning new device internal-dpl-aod-global-analysis-file-sink in process with pid 275087
[275087:internal-dpl-aod-global-analysis-file-sink]: [10:48:55][INFO] 
[275087:internal-dpl-aod-global-analysis-file-sink]:       ______      _    _______  _________ 
[275087:internal-dpl-aod-global-analysis-file-sink]:      / ____/___ _(_)_______   |/  /_  __ \    version 1.10.0
[275087:internal-dpl-aod-global-analysis-file-sink]:     / /_  / __ `/ / ___/__  /|_/ /_  / / /    build RELWITHDEBINFO
[275087:internal-dpl-aod-global-analysis-file-sink]:    / __/ / /_/ / / /    _  /  / / / /_/ /     https://github.com/FairRootGroup/FairMQ
[275087:internal-dpl-aod-global-analysis-file-sink]:   /_/    \__,_/_/_/     /_/  /_/  \___\_\     LGPL-3.0  © 2012-2025 GSI
[275087:internal-dpl-aod-global-analysis-file-sink]: 
[275087:internal-dpl-aod-global-analysis-file-sink]: [10:48:55][STATE] Starting FairMQ state machine --> IDLE
[275084:internal-dpl-clock]: [10:48:55][STATE] IDLE ---> INITIALIZING DEVICE
[275086:strangeness_derived_tutorial]: [10:48:55][STATE] IDLE ---> INITIALIZING DEVICE
[275087:internal-dpl-aod-global-analysis-file-sink]: [10:48:55][STATE] IDLE ---> INITIALIZING DEVICE
[275088:internal-dpl-injected-dummy-sink]: [INFO] Instrumenting crash signals
[275085:internal-dpl-aod-reader]: [10:48:55][STATE] IDLE ---> INITIALIZING DEVICE
[275087:internal-dpl-aod-global-analysis-file-sink]: [10:48:55][STATE] INITIALIZING DEVICE ---> INITIALIZED
[275087:internal-dpl-aod-global-analysis-file-sink]: [10:48:55][STATE] INITIALIZED ---> BINDING
[275087:internal-dpl-aod-global-analysis-file-sink]: [10:48:55][STATE] BINDING ---> BOUND
[275087:internal-dpl-aod-global-analysis-file-sink]: [10:48:55][STATE] BOUND ---> CONNECTING
[275088:internal-dpl-injected-dummy-sink]: [INFO] Spawning new device internal-dpl-injected-dummy-sink in process with pid 275088
[275086:strangeness_derived_tutorial]: [10:48:55][STATE] INITIALIZING DEVICE ---> INITIALIZED
[275084:internal-dpl-clock]: [10:48:55][STATE] INITIALIZING DEVICE ---> INITIALIZED
[275086:strangeness_derived_tutorial]: [10:48:55][STATE] INITIALIZED ---> BINDING
[275084:internal-dpl-clock]: [10:48:55][STATE] INITIALIZED ---> BINDING
[275087:internal-dpl-aod-global-analysis-file-sink]: [10:48:55][STATE] CONNECTING ---> DEVICE READY
[275087:internal-dpl-aod-global-analysis-file-sink]: [10:48:55][STATE] DEVICE READY ---> INITIALIZING TASK
[275088:internal-dpl-injected-dummy-sink]: [10:48:55][INFO] 
[275088:internal-dpl-injected-dummy-sink]:       ______      _    _______  _________ 
[275088:internal-dpl-injected-dummy-sink]:      / ____/___ _(_)_______   |/  /_  __ \    version 1.10.0
[275088:internal-dpl-injected-dummy-sink]:     / /_  / __ `/ / ___/__  /|_/ /_  / / /    build RELWITHDEBINFO
[275088:internal-dpl-injected-dummy-sink]:    / __/ / /_/ / / /    _  /  / / / /_/ /     https://github.com/FairRootGroup/FairMQ
[275088:internal-dpl-injected-dummy-sink]:   /_/    \__,_/_/_/     /_/  /_/  \___\_\     LGPL-3.0  © 2012-2025 GSI
[275088:internal-dpl-injected-dummy-sink]: 
[275087:internal-dpl-aod-global-analysis-file-sink]: [10:48:55][STATE] INITIALIZING TASK ---> READY
[275087:internal-dpl-aod-global-analysis-file-sink]: [10:48:55][STATE] READY ---> RUNNING
[275087:internal-dpl-aod-global-analysis-file-sink]: [10:48:55][INFO] fair::mq::Device running...
[275084:internal-dpl-clock]: [10:48:55][STATE] BINDING ---> BOUND
[275086:strangeness_derived_tutorial]: [10:48:55][STATE] BINDING ---> BOUND
[275088:internal-dpl-injected-dummy-sink]: [10:48:55][STATE] Starting FairMQ state machine --> IDLE
[275087:internal-dpl-aod-global-analysis-file-sink]: [10:48:55][INFO] LHCPeriod is not available, using current month NOV
[275084:internal-dpl-clock]: [10:48:55][STATE] BOUND ---> CONNECTING
[275084:internal-dpl-clock]: [10:48:55][STATE] CONNECTING ---> DEVICE READY
[275086:strangeness_derived_tutorial]: [10:48:55][STATE] BOUND ---> CONNECTING
[275084:internal-dpl-clock]: [10:48:55][STATE] DEVICE READY ---> INITIALIZING TASK
[275084:internal-dpl-clock]: [10:48:55][STATE] INITIALIZING TASK ---> READY
[275084:internal-dpl-clock]: [10:48:55][STATE] READY ---> RUNNING
[275084:internal-dpl-clock]: [10:48:55][INFO] fair::mq::Device running...
[275084:internal-dpl-clock]: [10:48:55][INFO] LHCPeriod is not available, using current month NOV
[275086:strangeness_derived_tutorial]: [10:48:55][STATE] CONNECTING ---> DEVICE READY
[275086:strangeness_derived_tutorial]: [10:48:55][STATE] DEVICE READY ---> INITIALIZING TASK
[275087:internal-dpl-aod-global-analysis-file-sink]: [10:48:55][INFO] Correctly handshaken websocket connection.
[INFO] Controller for internal-dpl-aod-reader not yet available.
[275084:internal-dpl-clock]: [10:48:55][INFO] Correctly handshaken websocket connection.
[275086:strangeness_derived_tutorial]: [10:48:55][STATE] INITIALIZING TASK ---> READY
[275086:strangeness_derived_tutorial]: [10:48:55][STATE] READY ---> RUNNING
[275086:strangeness_derived_tutorial]: [10:48:55][INFO] fair::mq::Device running...
[275086:strangeness_derived_tutorial]: [10:48:55][INFO] LHCPeriod is not available, using current month NOV
[275086:strangeness_derived_tutorial]: [10:48:55][INFO] Correctly handshaken websocket connection.
[275088:internal-dpl-injected-dummy-sink]: [10:48:55][STATE] IDLE ---> INITIALIZING DEVICE
[275088:internal-dpl-injected-dummy-sink]: [10:48:55][STATE] INITIALIZING DEVICE ---> INITIALIZED
[275088:internal-dpl-injected-dummy-sink]: [10:48:55][STATE] INITIALIZED ---> BINDING
[275088:internal-dpl-injected-dummy-sink]: [10:48:55][STATE] BINDING ---> BOUND
[275088:internal-dpl-injected-dummy-sink]: [10:48:55][STATE] BOUND ---> CONNECTING
[275088:internal-dpl-injected-dummy-sink]: [10:48:55][STATE] CONNECTING ---> DEVICE READY
[275088:internal-dpl-injected-dummy-sink]: [10:48:55][STATE] DEVICE READY ---> INITIALIZING TASK
[275088:internal-dpl-injected-dummy-sink]: [10:48:55][STATE] INITIALIZING TASK ---> READY
[275088:internal-dpl-injected-dummy-sink]: [10:48:55][STATE] READY ---> RUNNING
[275088:internal-dpl-injected-dummy-sink]: [10:48:55][INFO] fair::mq::Device running...
[275088:internal-dpl-injected-dummy-sink]: [10:48:55][INFO] LHCPeriod is not available, using current month NOV
[275088:internal-dpl-injected-dummy-sink]: [10:48:55][INFO] Correctly handshaken websocket connection.
[275085:internal-dpl-aod-reader]: [10:48:55][STATE] INITIALIZING DEVICE ---> INITIALIZED
[275085:internal-dpl-aod-reader]: [10:48:55][STATE] INITIALIZED ---> BINDING
[275085:internal-dpl-aod-reader]: [10:48:55][STATE] BINDING ---> BOUND
[275085:internal-dpl-aod-reader]: [10:48:55][STATE] BOUND ---> CONNECTING
[275085:internal-dpl-aod-reader]: [10:48:55][STATE] CONNECTING ---> DEVICE READY
[275085:internal-dpl-aod-reader]: [10:48:55][STATE] DEVICE READY ---> INITIALIZING TASK
[INFO] Controller for internal-dpl-aod-reader now available.
[275085:internal-dpl-aod-reader]: [10:48:55][STATE] INITIALIZING TASK ---> READY
[275085:internal-dpl-aod-reader]: [10:48:55][STATE] READY ---> RUNNING
[275085:internal-dpl-aod-reader]: [10:48:55][INFO] fair::mq::Device running...
[275085:internal-dpl-aod-reader]: [10:48:55][INFO] LHCPeriod is not available, using current month NOV
[275085:internal-dpl-aod-reader]: [10:48:55][INFO] Correctly handshaken websocket connection.
[275085:internal-dpl-aod-reader]: [10:48:55][WARN] Not enough resources to schedule computation. 0 skipped so far. Last scheduled at 0.
[275085:internal-dpl-aod-reader]: [10:48:55][WARN] Not enough resources to schedule computation. 1 skipped so far. Last scheduled at 0.
[275085:internal-dpl-aod-reader]: [10:48:55][WARN] Not enough resources to schedule computation. 2 skipped so far. Last scheduled at 0.
[275085:internal-dpl-aod-reader]: [10:48:55][INFO] Opening file: lfn=/home/cicero/O2Tutorial_2025/AO2D.root,size=57000273
[275088:internal-dpl-injected-dummy-sink]: [10:48:55][INFO] Domain info updated with timeslice 1
[275086:strangeness_derived_tutorial]: /home/cicero/alice/sw/BUILD/5d32fd791cd718ddf7c99fb922a432d5ce9676f3/arrow/src_tmp/cpp/src/gandiva/cache.cc:58: Creating gandiva cache with capacity of 5000
[275086:strangeness_derived_tutorial]: /home/cicero/alice/sw/BUILD/5d32fd791cd718ddf7c99fb922a432d5ce9676f3/arrow/src_tmp/cpp/src/gandiva/engine.cc:282: Detected CPU Name : znver2
[275086:strangeness_derived_tutorial]: /home/cicero/alice/sw/BUILD/5d32fd791cd718ddf7c99fb922a432d5ce9676f3/arrow/src_tmp/cpp/src/gandiva/engine.cc:283: Detected CPU Features: [ +prfchw -cldemote +avx +aes +sahf +pclmul -xop +crc32 -amx-fp8 +xsaves -avx512fp16 -usermsr -sm4 -egpr +sse4.1 -avx512ifma +xsave +sse4.2 -tsxldtrk -sm3 -ptwrite -widekl -movrs -invpcid +64bit +xsavec -avx10.1-512 -avx512vpopcntdq +cmov -avx512vp2intersect -avx512cd +movbe -avxvnniint8 -ccmp -amx-int8 -kl -avx10.1-256 -sha512 -avxvnni -rtm +adx +avx2 -hreset -movdiri -serialize -vpclmulqdq -avx512vl -uintr -cf +clflushopt -raoint -cmpccxadd +bmi -amx-tile +sse -avx10.2-256 -gfni -avxvnniint16 -amx-fp16 -zu -ndd +xsaveopt +rdrnd -avx512f -amx-bf16 -avx512bf16 -avx512vnni -push2pop2 +cx8 -avx512bw +sse3 -pku -nf -amx-tf32 -amx-avx512 +fsgsbase +clzero +mwaitx -lwp +lzcnt +sha -movdir64b -ppx +wbnoinvd -enqcmd -amx-transpose -avx10.2-512 -avxneconvert -tbm -pconfig -amx-complex +ssse3 +cx16 +bmi2 +fma +popcnt -avxifma +f16c -avx512bitalg +rdpru +clwb +mmx +sse2 +rdseed -avx512vbmi2 -prefetchi -amx-movrs +rdpid -fma4 -avx512vbmi -shstk -vaes -waitpkg -sgx +fxsr -avx512dq +sse4a]
[275088:internal-dpl-injected-dummy-sink]: [10:48:55][INFO] Domain info updated with timeslice 2
[275088:internal-dpl-injected-dummy-sink]: [10:48:55][INFO] Domain info updated with timeslice 3
[275088:internal-dpl-injected-dummy-sink]: [10:48:55][INFO] Domain info updated with timeslice 4
[275088:internal-dpl-injected-dummy-sink]: [10:48:55][INFO] Domain info updated with timeslice 5
[275088:internal-dpl-injected-dummy-sink]: [10:48:55][INFO] Domain info updated with timeslice 6
[275088:internal-dpl-injected-dummy-sink]: [10:48:55][INFO] Domain info updated with timeslice 7
[275088:internal-dpl-injected-dummy-sink]: [10:48:55][INFO] Domain info updated with timeslice 8
[275088:internal-dpl-injected-dummy-sink]: [10:48:55][INFO] Domain info updated with timeslice 9
[275088:internal-dpl-injected-dummy-sink]: [10:48:55][INFO] Domain info updated with timeslice 10
[275088:internal-dpl-injected-dummy-sink]: [10:48:55][INFO] Domain info updated with timeslice 11
[275088:internal-dpl-injected-dummy-sink]: [10:48:55][INFO] Domain info updated with timeslice 12
[275088:internal-dpl-injected-dummy-sink]: [10:48:55][INFO] Domain info updated with timeslice 13
[275088:internal-dpl-injected-dummy-sink]: [10:48:55][INFO] Domain info updated with timeslice 14
[275088:internal-dpl-injected-dummy-sink]: [10:48:55][INFO] Domain info updated with timeslice 15
[275088:internal-dpl-injected-dummy-sink]: [10:48:55][INFO] Domain info updated with timeslice 16
[275088:internal-dpl-injected-dummy-sink]: [10:48:55][INFO] Domain info updated with timeslice 17
[275088:internal-dpl-injected-dummy-sink]: [10:48:55][INFO] Domain info updated with timeslice 18
[275088:internal-dpl-injected-dummy-sink]: [10:48:55][INFO] Domain info updated with timeslice 19
[275088:internal-dpl-injected-dummy-sink]: [10:48:55][INFO] Domain info updated with timeslice 20
[275088:internal-dpl-injected-dummy-sink]: [10:48:55][INFO] Domain info updated with timeslice 21
[275088:internal-dpl-injected-dummy-sink]: [10:48:55][INFO] Domain info updated with timeslice 22
[275088:internal-dpl-injected-dummy-sink]: [10:48:55][INFO] Domain info updated with timeslice 23
[275088:internal-dpl-injected-dummy-sink]: [10:48:55][INFO] Domain info updated with timeslice 24
[275088:internal-dpl-injected-dummy-sink]: [10:48:55][INFO] Domain info updated with timeslice 25
[275088:internal-dpl-injected-dummy-sink]: [10:48:55][INFO] Domain info updated with timeslice 26
[275088:internal-dpl-injected-dummy-sink]: [10:48:55][INFO] Domain info updated with timeslice 27
[275088:internal-dpl-injected-dummy-sink]: [10:48:55][INFO] Domain info updated with timeslice 28
[275088:internal-dpl-injected-dummy-sink]: [10:48:55][INFO] Domain info updated with timeslice 29
[275088:internal-dpl-injected-dummy-sink]: [10:48:55][INFO] Domain info updated with timeslice 30
[275088:internal-dpl-injected-dummy-sink]: [10:48:55][INFO] Domain info updated with timeslice 31
[275088:internal-dpl-injected-dummy-sink]: [10:48:55][INFO] Domain info updated with timeslice 32
[275088:internal-dpl-injected-dummy-sink]: [10:48:55][INFO] Domain info updated with timeslice 33
[275088:internal-dpl-injected-dummy-sink]: [10:48:55][INFO] Domain info updated with timeslice 34
[275088:internal-dpl-injected-dummy-sink]: [10:48:55][INFO] Domain info updated with timeslice 35
[275088:internal-dpl-injected-dummy-sink]: [10:48:55][INFO] Domain info updated with timeslice 36
[275088:internal-dpl-injected-dummy-sink]: [10:48:55][INFO] Domain info updated with timeslice 37
[275088:internal-dpl-injected-dummy-sink]: [10:48:55][INFO] Domain info updated with timeslice 38
[275088:internal-dpl-injected-dummy-sink]: [10:48:55][INFO] Domain info updated with timeslice 39
[275088:internal-dpl-injected-dummy-sink]: [10:48:55][INFO] Domain info updated with timeslice 40
[275088:internal-dpl-injected-dummy-sink]: [10:48:55][INFO] Domain info updated with timeslice 41
[275088:internal-dpl-injected-dummy-sink]: [10:48:55][INFO] Domain info updated with timeslice 42
[275088:internal-dpl-injected-dummy-sink]: [10:48:55][INFO] Domain info updated with timeslice 43
[275088:internal-dpl-injected-dummy-sink]: [10:48:55][INFO] Domain info updated with timeslice 44
[275088:internal-dpl-injected-dummy-sink]: [10:48:55][INFO] Domain info updated with timeslice 45
[275088:internal-dpl-injected-dummy-sink]: [10:48:55][INFO] Domain info updated with timeslice 46
[275088:internal-dpl-injected-dummy-sink]: [10:48:55][INFO] Domain info updated with timeslice 47
[275088:internal-dpl-injected-dummy-sink]: [10:48:55][INFO] Domain info updated with timeslice 48
[275088:internal-dpl-injected-dummy-sink]: [10:48:55][INFO] Domain info updated with timeslice 49
[275088:internal-dpl-injected-dummy-sink]: [10:48:55][INFO] Domain info updated with timeslice 50
[275088:internal-dpl-injected-dummy-sink]: [10:48:55][INFO] Domain info updated with timeslice 51
[275088:internal-dpl-injected-dummy-sink]: [10:48:55][INFO] Domain info updated with timeslice 52
[275088:internal-dpl-injected-dummy-sink]: [10:48:55][INFO] Domain info updated with timeslice 53
[275088:internal-dpl-injected-dummy-sink]: [10:48:55][INFO] Domain info updated with timeslice 54
[275088:internal-dpl-injected-dummy-sink]: [10:48:55][INFO] Domain info updated with timeslice 55
[275088:internal-dpl-injected-dummy-sink]: [10:48:55][INFO] Domain info updated with timeslice 56
[275088:internal-dpl-injected-dummy-sink]: [10:48:55][INFO] Domain info updated with timeslice 57
[275088:internal-dpl-injected-dummy-sink]: [10:48:55][INFO] Domain info updated with timeslice 58
[275088:internal-dpl-injected-dummy-sink]: [10:48:55][INFO] Domain info updated with timeslice 59
[275088:internal-dpl-injected-dummy-sink]: [10:48:55][INFO] Domain info updated with timeslice 60
[275088:internal-dpl-injected-dummy-sink]: [10:48:55][INFO] Domain info updated with timeslice 61
[275088:internal-dpl-injected-dummy-sink]: [10:48:55][INFO] Domain info updated with timeslice 62
[275088:internal-dpl-injected-dummy-sink]: [10:48:55][INFO] Domain info updated with timeslice 63
[275088:internal-dpl-injected-dummy-sink]: [10:48:55][INFO] Domain info updated with timeslice 64
[275088:internal-dpl-injected-dummy-sink]: [10:48:56][INFO] Domain info updated with timeslice 65
[275088:internal-dpl-injected-dummy-sink]: [10:48:56][INFO] Domain info updated with timeslice 66
[275088:internal-dpl-injected-dummy-sink]: [10:48:56][INFO] Domain info updated with timeslice 67
[275088:internal-dpl-injected-dummy-sink]: [10:48:56][INFO] Domain info updated with timeslice 68
[275088:internal-dpl-injected-dummy-sink]: [10:48:56][INFO] Domain info updated with timeslice 69
[275088:internal-dpl-injected-dummy-sink]: [10:48:56][INFO] Domain info updated with timeslice 70
[275088:internal-dpl-injected-dummy-sink]: [10:48:56][INFO] Domain info updated with timeslice 71
[275088:internal-dpl-injected-dummy-sink]: [10:48:56][INFO] Domain info updated with timeslice 72
[275088:internal-dpl-injected-dummy-sink]: [10:48:56][INFO] Domain info updated with timeslice 73
[275088:internal-dpl-injected-dummy-sink]: [10:48:56][INFO] Domain info updated with timeslice 74
[275088:internal-dpl-injected-dummy-sink]: [10:48:56][INFO] Domain info updated with timeslice 75
[275088:internal-dpl-injected-dummy-sink]: [10:48:56][INFO] Domain info updated with timeslice 76
[275088:internal-dpl-injected-dummy-sink]: [10:48:56][INFO] Domain info updated with timeslice 77
[275088:internal-dpl-injected-dummy-sink]: [10:48:56][INFO] Domain info updated with timeslice 78
[275088:internal-dpl-injected-dummy-sink]: [10:48:56][INFO] Domain info updated with timeslice 79
[275088:internal-dpl-injected-dummy-sink]: [10:48:56][INFO] Domain info updated with timeslice 80
[275088:internal-dpl-injected-dummy-sink]: [10:48:56][INFO] Domain info updated with timeslice 81
[275088:internal-dpl-injected-dummy-sink]: [10:48:56][INFO] Domain info updated with timeslice 82
[275088:internal-dpl-injected-dummy-sink]: [10:48:56][INFO] Domain info updated with timeslice 83
[275088:internal-dpl-injected-dummy-sink]: [10:48:56][INFO] Domain info updated with timeslice 84
[275088:internal-dpl-injected-dummy-sink]: [10:48:56][INFO] Domain info updated with timeslice 85
[275088:internal-dpl-injected-dummy-sink]: [10:48:56][INFO] Domain info updated with timeslice 86
[275088:internal-dpl-injected-dummy-sink]: [10:48:56][INFO] Domain info updated with timeslice 87
[275088:internal-dpl-injected-dummy-sink]: [10:48:56][INFO] Domain info updated with timeslice 88
[275088:internal-dpl-injected-dummy-sink]: [10:48:56][INFO] Domain info updated with timeslice 89
[275088:internal-dpl-injected-dummy-sink]: [10:48:56][INFO] Domain info updated with timeslice 90
[275088:internal-dpl-injected-dummy-sink]: [10:48:56][INFO] Domain info updated with timeslice 91
[275088:internal-dpl-injected-dummy-sink]: [10:48:56][INFO] Domain info updated with timeslice 92
[275088:internal-dpl-injected-dummy-sink]: [10:48:56][INFO] Domain info updated with timeslice 93
[275088:internal-dpl-injected-dummy-sink]: [10:48:56][INFO] Domain info updated with timeslice 94
[275088:internal-dpl-injected-dummy-sink]: [10:48:56][INFO] Domain info updated with timeslice 95
[275088:internal-dpl-injected-dummy-sink]: [10:48:56][INFO] Domain info updated with timeslice 96
[275088:internal-dpl-injected-dummy-sink]: [10:48:56][INFO] Domain info updated with timeslice 97
[275088:internal-dpl-injected-dummy-sink]: [10:48:56][INFO] Domain info updated with timeslice 98
[275088:internal-dpl-injected-dummy-sink]: [10:48:56][INFO] Domain info updated with timeslice 99
[275088:internal-dpl-injected-dummy-sink]: [10:48:56][INFO] Domain info updated with timeslice 100
[275085:internal-dpl-aod-reader]: [10:48:56][INFO] No input files left to read for reader 0!
[275085:internal-dpl-aod-reader]: [10:48:56][INFO] Read info: lfn=/home/cicero/O2Tutorial_2025/AO2D.root,size=57000273,total_df=100,read_df=100,read_bytes=8938244,read_calls=704,io_time=0.4,wait_time=0.1,level=0
[275085:internal-dpl-aod-reader]: [10:48:56][INFO] Sending end-of-stream message to channel from_internal-dpl-aod-reader_to_strangeness_derived_tutorial
[275085:internal-dpl-aod-reader]: [10:48:56][INFO] Sending end-of-stream message to channel from_internal-dpl-aod-reader_to_internal-dpl-injected-dummy-sink
[275088:internal-dpl-injected-dummy-sink]: [10:48:56][INFO] Domain info updated with timeslice 101
[275086:strangeness_derived_tutorial]: [10:48:56][INFO] Sending end-of-stream message to channel from_strangeness_derived_tutorial_to_internal-dpl-aod-global-analysis-file-sink
[INFO] Quitting
[INFO] Quit requested at Wed Nov 12 10:48:56 2025

[275084:internal-dpl-clock]: [10:48:56][INFO] Received device shutdown request (signal 15).
[275084:internal-dpl-clock]: [10:48:56][INFO] Waiting for graceful device shutdown. Hit Ctrl-C again to abort immediately.
[275086:strangeness_derived_tutorial]: [10:48:56][INFO] Received device shutdown request (signal 15).
[275086:strangeness_derived_tutorial]: [10:48:56][INFO] Waiting for graceful device shutdown. Hit Ctrl-C again to abort immediately.
[275087:internal-dpl-aod-global-analysis-file-sink]: [10:48:56][INFO] Received device shutdown request (signal 15).
[275087:internal-dpl-aod-global-analysis-file-sink]: [10:48:56][INFO] Waiting for graceful device shutdown. Hit Ctrl-C again to abort immediately.
[275084:internal-dpl-clock]: [10:48:56][INFO] New state requested. No timeout set, quitting immediately as per --completion-policy
[275086:strangeness_derived_tutorial]: [10:48:56][INFO] New state requested. No timeout set, quitting immediately as per --completion-policy
[275087:internal-dpl-aod-global-analysis-file-sink]: [10:48:56][INFO] New state requested. No timeout set, quitting immediately as per --completion-policy
[275087:internal-dpl-aod-global-analysis-file-sink]: [10:48:56][STATE] RUNNING ---> READY
[275086:strangeness_derived_tutorial]: [10:48:56][STATE] RUNNING ---> READY
[275086:strangeness_derived_tutorial]: [10:48:56][STATE] READY ---> RESETTING TASK
[275086:strangeness_derived_tutorial]: [10:48:56][STATE] RESETTING TASK ---> DEVICE READY
[275087:internal-dpl-aod-global-analysis-file-sink]: [10:48:56][STATE] READY ---> RESETTING TASK
[275087:internal-dpl-aod-global-analysis-file-sink]: [10:48:56][STATE] RESETTING TASK ---> DEVICE READY
[275084:internal-dpl-clock]: [10:48:56][INFO] Sending end-of-stream message to channel from_internal-dpl-clock_to_internal-dpl-aod-reader
[275084:internal-dpl-clock]: [10:48:56][STATE] RUNNING ---> READY
[275086:strangeness_derived_tutorial]: [10:48:56][STATE] DEVICE READY ---> RESETTING DEVICE
[275087:internal-dpl-aod-global-analysis-file-sink]: [10:48:56][STATE] DEVICE READY ---> RESETTING DEVICE
[275085:internal-dpl-aod-reader]: [10:48:56][INFO] Received device shutdown request (signal 15).
[275085:internal-dpl-aod-reader]: [10:48:56][INFO] Waiting for graceful device shutdown. Hit Ctrl-C again to abort immediately.
[275084:internal-dpl-clock]: [10:48:56][STATE] READY ---> RESETTING TASK
[275084:internal-dpl-clock]: [10:48:56][STATE] RESETTING TASK ---> DEVICE READY
[275084:internal-dpl-clock]: [10:48:56][STATE] DEVICE READY ---> RESETTING DEVICE
[275085:internal-dpl-aod-reader]: [10:48:56][INFO] New state requested. No timeout set, quitting immediately as per --completion-policy
[275085:internal-dpl-aod-reader]: [10:48:56][STATE] RUNNING ---> READY
[275085:internal-dpl-aod-reader]: [10:48:56][STATE] READY ---> RESETTING TASK
[275085:internal-dpl-aod-reader]: [10:48:56][STATE] RESETTING TASK ---> DEVICE READY
[275085:internal-dpl-aod-reader]: [10:48:56][STATE] DEVICE READY ---> RESETTING DEVICE
[275086:strangeness_derived_tutorial]: [10:48:56][STATE] RESETTING DEVICE ---> IDLE
[275086:strangeness_derived_tutorial]: [10:48:56][STATE] IDLE ---> EXITING
[275087:internal-dpl-aod-global-analysis-file-sink]: [10:48:56][STATE] RESETTING DEVICE ---> IDLE
[275087:internal-dpl-aod-global-analysis-file-sink]: [10:48:56][STATE] IDLE ---> EXITING
[275084:internal-dpl-clock]: [10:48:56][STATE] RESETTING DEVICE ---> IDLE
[275084:internal-dpl-clock]: [10:48:56][STATE] IDLE ---> EXITING
[275084:internal-dpl-clock]: [10:48:56][STATE] Exiting FairMQ state machine
[275087:internal-dpl-aod-global-analysis-file-sink]: [10:48:56][STATE] Exiting FairMQ state machine
[275085:internal-dpl-aod-reader]: [10:48:56][STATE] RESETTING DEVICE ---> IDLE
[275085:internal-dpl-aod-reader]: [10:48:56][STATE] IDLE ---> EXITING
[275086:strangeness_derived_tutorial]: [10:48:56][STATE] Exiting FairMQ state machine
[275085:internal-dpl-aod-reader]: [10:48:56][STATE] Exiting FairMQ state machine
[275088:internal-dpl-injected-dummy-sink]: [10:48:56][INFO] Received device shutdown request (signal 15).
[275088:internal-dpl-injected-dummy-sink]: [10:48:56][INFO] Waiting for graceful device shutdown. Hit Ctrl-C again to abort immediately.
[275088:internal-dpl-injected-dummy-sink]: [10:48:56][INFO] New state requested. No timeout set, quitting immediately as per --completion-policy
[275088:internal-dpl-injected-dummy-sink]: [10:48:56][STATE] RUNNING ---> READY
[275088:internal-dpl-injected-dummy-sink]: [10:48:56][STATE] READY ---> RESETTING TASK
[275088:internal-dpl-injected-dummy-sink]: [10:48:56][STATE] RESETTING TASK ---> DEVICE READY
[275088:internal-dpl-injected-dummy-sink]: [10:48:56][STATE] DEVICE READY ---> RESETTING DEVICE
[275088:internal-dpl-injected-dummy-sink]: [10:48:56][INFO] Cleaning up for shared memory id '15130ef7'...
[275088:internal-dpl-injected-dummy-sink]: [10:48:56][INFO] Found 0 unmanaged regions...
[275088:internal-dpl-injected-dummy-sink]: [10:48:56][INFO] Found 1 managed segments...
[275088:internal-dpl-injected-dummy-sink]: [10:48:56][INFO] Successfully removed 'fmq_15130ef7_m_0'.
[275088:internal-dpl-injected-dummy-sink]: [10:48:56][INFO] Successfully removed 'fmq_15130ef7_mng'.
[275088:internal-dpl-injected-dummy-sink]: [10:48:56][STATE] RESETTING DEVICE ---> IDLE
[275088:internal-dpl-injected-dummy-sink]: [10:48:56][STATE] IDLE ---> EXITING
[275088:internal-dpl-injected-dummy-sink]: [10:48:56][STATE] Exiting FairMQ state machine
[INFO] ## Processes completed. Run summary:
[INFO] ### Devices started: 5
[INFO]  - Device internal-dpl-clock: pid 275084 (exit 0)
[INFO]  - Device internal-dpl-aod-reader: pid 275085 (exit 0)
[INFO]  - Device strangeness_derived_tutorial: pid 275086 (exit 0)
[INFO]  - Device internal-dpl-aod-global-analysis-file-sink: pid 275087 (exit 0)
[INFO]  - Device internal-dpl-injected-dummy-sink: pid 275088 (exit 0)
[INFO] ## Analysis Run Summary ##
[INFO] ### Files read stats ###
[INFO] lfn=/home/cicero/O2Tutorial_2025/AO2D.root,size=57000273,total_df=100,read_df=100,read_bytes=8938244,read_calls=704,io_time=0.4,wait_time=0.1,level=0
[INFO] ### Files opened stats ###
[INFO] Last file opened: lfn=/home/cicero/O2Tutorial_2025/AO2D.root,size=57000273
[INFO] Dumping used configuration in dpl-config.json
