[INFO] Loading metadata from file /home/cicero/O2Tutorial_2025/AO2D.root in PID 275979
[INFO] No metadata found in file "/home/cicero/O2Tutorial_2025/AO2D.root" and parent level 0 prevents further lookup.
[INFO] Initialising O2 Data Processing Layer. Driver PID: 275979.
[INFO] Driver listening on port: 14059
[INFO] Rate limiting set up at 500 MB and 1 timeframes distributed over 1 readers
[INFO] O2 Data Processing Layer initialised. We brake for nobody.
[INFO] Optimised build. O2DEBUG / LOG(debug) / LOGF(debug) / assert statement will not be shown.
[INFO] Redeployment of configuration asked.
[INFO] Starting internal-dpl-clock on pid 275988
[INFO] Starting internal-dpl-aod-reader on pid 275989
[INFO] Starting strangeness_derived_tutorial on pid 275990
[INFO] Starting internal-dpl-aod-global-analysis-file-sink on pid 275991
[INFO] Starting internal-dpl-injected-dummy-sink on pid 275992
[INFO] Redeployment of configuration done.
[275989:internal-dpl-aod-reader]: [INFO] Instrumenting crash signals
[275990:strangeness_derived_tutorial]: [INFO] Instrumenting crash signals
[275989:internal-dpl-aod-reader]: [INFO] Spawning new device internal-dpl-aod-reader in process with pid 275989
[275989:internal-dpl-aod-reader]: [11:00:06][INFO] 
[275989:internal-dpl-aod-reader]:       ______      _    _______  _________ 
[275989:internal-dpl-aod-reader]:      / ____/___ _(_)_______   |/  /_  __ \    version 1.10.0
[275989:internal-dpl-aod-reader]:     / /_  / __ `/ / ___/__  /|_/ /_  / / /    build RELWITHDEBINFO
[275989:internal-dpl-aod-reader]:    / __/ / /_/ / / /    _  /  / / / /_/ /     https://github.com/FairRootGroup/FairMQ
[275989:internal-dpl-aod-reader]:   /_/    \__,_/_/_/     /_/  /_/  \___\_\     LGPL-3.0  © 2012-2025 GSI
[275989:internal-dpl-aod-reader]: 
[275989:internal-dpl-aod-reader]: [11:00:06][STATE] Starting FairMQ state machine --> IDLE
[275990:strangeness_derived_tutorial]: [INFO] Spawning new device strangeness_derived_tutorial in process with pid 275990
[275991:internal-dpl-aod-global-analysis-file-sink]: [INFO] Instrumenting crash signals
[275990:strangeness_derived_tutorial]: [11:00:06][INFO] 
[275990:strangeness_derived_tutorial]:       ______      _    _______  _________ 
[275990:strangeness_derived_tutorial]:      / ____/___ _(_)_______   |/  /_  __ \    version 1.10.0
[275990:strangeness_derived_tutorial]:     / /_  / __ `/ / ___/__  /|_/ /_  / / /    build RELWITHDEBINFO
[275990:strangeness_derived_tutorial]:    / __/ / /_/ / / /    _  /  / / / /_/ /     https://github.com/FairRootGroup/FairMQ
[275990:strangeness_derived_tutorial]:   /_/    \__,_/_/_/     /_/  /_/  \___\_\     LGPL-3.0  © 2012-2025 GSI
[275990:strangeness_derived_tutorial]: 
[275988:internal-dpl-clock]: [INFO] Instrumenting crash signals
[275990:strangeness_derived_tutorial]: [11:00:06][STATE] Starting FairMQ state machine --> IDLE
[275991:internal-dpl-aod-global-analysis-file-sink]: [INFO] Spawning new device internal-dpl-aod-global-analysis-file-sink in process with pid 275991
[275988:internal-dpl-clock]: [INFO] Spawning new device internal-dpl-clock in process with pid 275988
[275991:internal-dpl-aod-global-analysis-file-sink]: [11:00:06][INFO] 
[275991:internal-dpl-aod-global-analysis-file-sink]:       ______      _    _______  _________ 
[275991:internal-dpl-aod-global-analysis-file-sink]:      / ____/___ _(_)_______   |/  /_  __ \    version 1.10.0
[275991:internal-dpl-aod-global-analysis-file-sink]:     / /_  / __ `/ / ___/__  /|_/ /_  / / /    build RELWITHDEBINFO
[275991:internal-dpl-aod-global-analysis-file-sink]:    / __/ / /_/ / / /    _  /  / / / /_/ /     https://github.com/FairRootGroup/FairMQ
[275991:internal-dpl-aod-global-analysis-file-sink]:   /_/    \__,_/_/_/     /_/  /_/  \___\_\     LGPL-3.0  © 2012-2025 GSI
[275991:internal-dpl-aod-global-analysis-file-sink]: 
[275991:internal-dpl-aod-global-analysis-file-sink]: [11:00:06][STATE] Starting FairMQ state machine --> IDLE
[275989:internal-dpl-aod-reader]: [11:00:06][STATE] IDLE ---> INITIALIZING DEVICE
[275988:internal-dpl-clock]: [11:00:06][INFO] 
[275988:internal-dpl-clock]:       ______      _    _______  _________ 
[275988:internal-dpl-clock]:      / ____/___ _(_)_______   |/  /_  __ \    version 1.10.0
[275988:internal-dpl-clock]:     / /_  / __ `/ / ___/__  /|_/ /_  / / /    build RELWITHDEBINFO
[275988:internal-dpl-clock]:    / __/ / /_/ / / /    _  /  / / / /_/ /     https://github.com/FairRootGroup/FairMQ
[275988:internal-dpl-clock]:   /_/    \__,_/_/_/     /_/  /_/  \___\_\     LGPL-3.0  © 2012-2025 GSI
[275988:internal-dpl-clock]: 
[275988:internal-dpl-clock]: [11:00:06][STATE] Starting FairMQ state machine --> IDLE
[275990:strangeness_derived_tutorial]: [11:00:06][STATE] IDLE ---> INITIALIZING DEVICE
[275990:strangeness_derived_tutorial]: [11:00:06][STATE] INITIALIZING DEVICE ---> INITIALIZED
[275990:strangeness_derived_tutorial]: [11:00:06][STATE] INITIALIZED ---> BINDING
[275990:strangeness_derived_tutorial]: [11:00:06][STATE] BINDING ---> BOUND
[275990:strangeness_derived_tutorial]: [11:00:06][STATE] BOUND ---> CONNECTING
[275991:internal-dpl-aod-global-analysis-file-sink]: [11:00:06][STATE] IDLE ---> INITIALIZING DEVICE
[275990:strangeness_derived_tutorial]: [11:00:06][STATE] CONNECTING ---> DEVICE READY
[275990:strangeness_derived_tutorial]: [11:00:06][STATE] DEVICE READY ---> INITIALIZING TASK
[275990:strangeness_derived_tutorial]: [11:00:06][STATE] INITIALIZING TASK ---> READY
[275990:strangeness_derived_tutorial]: [11:00:06][STATE] READY ---> RUNNING
[275990:strangeness_derived_tutorial]: [11:00:06][INFO] fair::mq::Device running...
[275990:strangeness_derived_tutorial]: [11:00:06][INFO] LHCPeriod is not available, using current month NOV
[275990:strangeness_derived_tutorial]: [11:00:06][INFO] Correctly handshaken websocket connection.
[INFO] Controller for internal-dpl-aod-reader not yet available.
[275988:internal-dpl-clock]: [11:00:06][STATE] IDLE ---> INITIALIZING DEVICE
[275988:internal-dpl-clock]: [11:00:06][STATE] INITIALIZING DEVICE ---> INITIALIZED
[275988:internal-dpl-clock]: [11:00:06][STATE] INITIALIZED ---> BINDING
[275991:internal-dpl-aod-global-analysis-file-sink]: [11:00:06][STATE] INITIALIZING DEVICE ---> INITIALIZED
[275991:internal-dpl-aod-global-analysis-file-sink]: [11:00:06][STATE] INITIALIZED ---> BINDING
[275991:internal-dpl-aod-global-analysis-file-sink]: [11:00:06][STATE] BINDING ---> BOUND
[275991:internal-dpl-aod-global-analysis-file-sink]: [11:00:06][STATE] BOUND ---> CONNECTING
[275991:internal-dpl-aod-global-analysis-file-sink]: [11:00:06][STATE] CONNECTING ---> DEVICE READY
[275991:internal-dpl-aod-global-analysis-file-sink]: [11:00:06][STATE] DEVICE READY ---> INITIALIZING TASK
[275991:internal-dpl-aod-global-analysis-file-sink]: [11:00:06][STATE] INITIALIZING TASK ---> READY
[275991:internal-dpl-aod-global-analysis-file-sink]: [11:00:06][STATE] READY ---> RUNNING
[275991:internal-dpl-aod-global-analysis-file-sink]: [11:00:06][INFO] fair::mq::Device running...
[275991:internal-dpl-aod-global-analysis-file-sink]: [11:00:06][INFO] LHCPeriod is not available, using current month NOV
[275992:internal-dpl-injected-dummy-sink]: [INFO] Instrumenting crash signals
[275988:internal-dpl-clock]: [11:00:06][STATE] BINDING ---> BOUND
[275988:internal-dpl-clock]: [11:00:06][STATE] BOUND ---> CONNECTING
[275988:internal-dpl-clock]: [11:00:06][STATE] CONNECTING ---> DEVICE READY
[275988:internal-dpl-clock]: [11:00:06][STATE] DEVICE READY ---> INITIALIZING TASK
[275991:internal-dpl-aod-global-analysis-file-sink]: [11:00:06][INFO] Correctly handshaken websocket connection.
[275988:internal-dpl-clock]: [11:00:06][STATE] INITIALIZING TASK ---> READY
[275988:internal-dpl-clock]: [11:00:06][STATE] READY ---> RUNNING
[275988:internal-dpl-clock]: [11:00:06][INFO] fair::mq::Device running...
[275988:internal-dpl-clock]: [11:00:06][INFO] LHCPeriod is not available, using current month NOV
[275988:internal-dpl-clock]: [11:00:06][INFO] Correctly handshaken websocket connection.
[275992:internal-dpl-injected-dummy-sink]: [INFO] Spawning new device internal-dpl-injected-dummy-sink in process with pid 275992
[275992:internal-dpl-injected-dummy-sink]: [11:00:06][INFO] 
[275992:internal-dpl-injected-dummy-sink]:       ______      _    _______  _________ 
[275992:internal-dpl-injected-dummy-sink]:      / ____/___ _(_)_______   |/  /_  __ \    version 1.10.0
[275992:internal-dpl-injected-dummy-sink]:     / /_  / __ `/ / ___/__  /|_/ /_  / / /    build RELWITHDEBINFO
[275992:internal-dpl-injected-dummy-sink]:    / __/ / /_/ / / /    _  /  / / / /_/ /     https://github.com/FairRootGroup/FairMQ
[275992:internal-dpl-injected-dummy-sink]:   /_/    \__,_/_/_/     /_/  /_/  \___\_\     LGPL-3.0  © 2012-2025 GSI
[275992:internal-dpl-injected-dummy-sink]: 
[275992:internal-dpl-injected-dummy-sink]: [11:00:06][STATE] Starting FairMQ state machine --> IDLE
[275989:internal-dpl-aod-reader]: [11:00:06][STATE] INITIALIZING DEVICE ---> INITIALIZED
[275989:internal-dpl-aod-reader]: [11:00:06][STATE] INITIALIZED ---> BINDING
[275989:internal-dpl-aod-reader]: [11:00:06][STATE] BINDING ---> BOUND
[275989:internal-dpl-aod-reader]: [11:00:06][STATE] BOUND ---> CONNECTING
[275989:internal-dpl-aod-reader]: [11:00:06][STATE] CONNECTING ---> DEVICE READY
[275989:internal-dpl-aod-reader]: [11:00:06][STATE] DEVICE READY ---> INITIALIZING TASK
[275989:internal-dpl-aod-reader]: [11:00:06][STATE] INITIALIZING TASK ---> READY
[275989:internal-dpl-aod-reader]: [11:00:06][STATE] READY ---> RUNNING
[275989:internal-dpl-aod-reader]: [11:00:06][INFO] fair::mq::Device running...
[275989:internal-dpl-aod-reader]: [11:00:06][INFO] LHCPeriod is not available, using current month NOV
[INFO] Controller for internal-dpl-aod-reader now available.
[275989:internal-dpl-aod-reader]: [11:00:06][WARN] Not enough resources to schedule computation. 0 skipped so far. Last scheduled at 0.
[275989:internal-dpl-aod-reader]: [11:00:06][WARN] Not enough resources to schedule computation. 1 skipped so far. Last scheduled at 0.
[275989:internal-dpl-aod-reader]: [11:00:06][INFO] Correctly handshaken websocket connection.
[275989:internal-dpl-aod-reader]: [11:00:06][WARN] Not enough resources to schedule computation. 2 skipped so far. Last scheduled at 0.
[275989:internal-dpl-aod-reader]: [11:00:06][WARN] Not enough resources to schedule computation. 3 skipped so far. Last scheduled at 0.
[275989:internal-dpl-aod-reader]: [11:00:06][WARN] Not enough resources to schedule computation. 4 skipped so far. Last scheduled at 0.
[275992:internal-dpl-injected-dummy-sink]: [11:00:06][STATE] IDLE ---> INITIALIZING DEVICE
[275992:internal-dpl-injected-dummy-sink]: [11:00:06][STATE] INITIALIZING DEVICE ---> INITIALIZED
[275992:internal-dpl-injected-dummy-sink]: [11:00:06][STATE] INITIALIZED ---> BINDING
[275992:internal-dpl-injected-dummy-sink]: [11:00:06][STATE] BINDING ---> BOUND
[275992:internal-dpl-injected-dummy-sink]: [11:00:06][STATE] BOUND ---> CONNECTING
[275992:internal-dpl-injected-dummy-sink]: [11:00:06][STATE] CONNECTING ---> DEVICE READY
[275992:internal-dpl-injected-dummy-sink]: [11:00:06][STATE] DEVICE READY ---> INITIALIZING TASK
[275992:internal-dpl-injected-dummy-sink]: [11:00:06][STATE] INITIALIZING TASK ---> READY
[275992:internal-dpl-injected-dummy-sink]: [11:00:06][STATE] READY ---> RUNNING
[275992:internal-dpl-injected-dummy-sink]: [11:00:06][INFO] fair::mq::Device running...
[275992:internal-dpl-injected-dummy-sink]: [11:00:06][INFO] LHCPeriod is not available, using current month NOV
[275992:internal-dpl-injected-dummy-sink]: [11:00:06][INFO] Correctly handshaken websocket connection.
[275989:internal-dpl-aod-reader]: [11:00:06][INFO] Opening file: lfn=/home/cicero/O2Tutorial_2025/AO2D.root,size=57000273
[275992:internal-dpl-injected-dummy-sink]: [11:00:07][INFO] Domain info updated with timeslice 1
[275990:strangeness_derived_tutorial]: /home/cicero/alice/sw/BUILD/5d32fd791cd718ddf7c99fb922a432d5ce9676f3/arrow/src_tmp/cpp/src/gandiva/cache.cc:58: Creating gandiva cache with capacity of 5000
[275990:strangeness_derived_tutorial]: /home/cicero/alice/sw/BUILD/5d32fd791cd718ddf7c99fb922a432d5ce9676f3/arrow/src_tmp/cpp/src/gandiva/engine.cc:282: Detected CPU Name : znver2
[275990:strangeness_derived_tutorial]: /home/cicero/alice/sw/BUILD/5d32fd791cd718ddf7c99fb922a432d5ce9676f3/arrow/src_tmp/cpp/src/gandiva/engine.cc:283: Detected CPU Features: [ +prfchw -cldemote +avx +aes +sahf +pclmul -xop +crc32 -amx-fp8 +xsaves -avx512fp16 -usermsr -sm4 -egpr +sse4.1 -avx512ifma +xsave +sse4.2 -tsxldtrk -sm3 -ptwrite -widekl -movrs -invpcid +64bit +xsavec -avx10.1-512 -avx512vpopcntdq +cmov -avx512vp2intersect -avx512cd +movbe -avxvnniint8 -ccmp -amx-int8 -kl -avx10.1-256 -sha512 -avxvnni -rtm +adx +avx2 -hreset -movdiri -serialize -vpclmulqdq -avx512vl -uintr -cf +clflushopt -raoint -cmpccxadd +bmi -amx-tile +sse -avx10.2-256 -gfni -avxvnniint16 -amx-fp16 -zu -ndd +xsaveopt +rdrnd -avx512f -amx-bf16 -avx512bf16 -avx512vnni -push2pop2 +cx8 -avx512bw +sse3 -pku -nf -amx-tf32 -amx-avx512 +fsgsbase +clzero +mwaitx -lwp +lzcnt +sha -movdir64b -ppx +wbnoinvd -enqcmd -amx-transpose -avx10.2-512 -avxneconvert -tbm -pconfig -amx-complex +ssse3 +cx16 +bmi2 +fma +popcnt -avxifma +f16c -avx512bitalg +rdpru +clwb +mmx +sse2 +rdseed -avx512vbmi2 -prefetchi -amx-movrs +rdpid -fma4 -avx512vbmi -shstk -vaes -waitpkg -sgx +fxsr -avx512dq +sse4a]
[275992:internal-dpl-injected-dummy-sink]: [11:00:07][INFO] Domain info updated with timeslice 2
[275992:internal-dpl-injected-dummy-sink]: [11:00:07][INFO] Domain info updated with timeslice 3
[275992:internal-dpl-injected-dummy-sink]: [11:00:07][INFO] Domain info updated with timeslice 4
[275992:internal-dpl-injected-dummy-sink]: [11:00:07][INFO] Domain info updated with timeslice 5
[275992:internal-dpl-injected-dummy-sink]: [11:00:07][INFO] Domain info updated with timeslice 6
[275992:internal-dpl-injected-dummy-sink]: [11:00:07][INFO] Domain info updated with timeslice 7
[275992:internal-dpl-injected-dummy-sink]: [11:00:07][INFO] Domain info updated with timeslice 8
[275992:internal-dpl-injected-dummy-sink]: [11:00:07][INFO] Domain info updated with timeslice 9
[275992:internal-dpl-injected-dummy-sink]: [11:00:07][INFO] Domain info updated with timeslice 10
[275992:internal-dpl-injected-dummy-sink]: [11:00:07][INFO] Domain info updated with timeslice 11
[275992:internal-dpl-injected-dummy-sink]: [11:00:07][INFO] Domain info updated with timeslice 12
[275992:internal-dpl-injected-dummy-sink]: [11:00:07][INFO] Domain info updated with timeslice 13
[275992:internal-dpl-injected-dummy-sink]: [11:00:07][INFO] Domain info updated with timeslice 14
[275992:internal-dpl-injected-dummy-sink]: [11:00:07][INFO] Domain info updated with timeslice 15
[275992:internal-dpl-injected-dummy-sink]: [11:00:07][INFO] Domain info updated with timeslice 16
[275992:internal-dpl-injected-dummy-sink]: [11:00:07][INFO] Domain info updated with timeslice 17
[275992:internal-dpl-injected-dummy-sink]: [11:00:07][INFO] Domain info updated with timeslice 18
[275992:internal-dpl-injected-dummy-sink]: [11:00:07][INFO] Domain info updated with timeslice 19
[275992:internal-dpl-injected-dummy-sink]: [11:00:07][INFO] Domain info updated with timeslice 20
[275992:internal-dpl-injected-dummy-sink]: [11:00:07][INFO] Domain info updated with timeslice 21
[275992:internal-dpl-injected-dummy-sink]: [11:00:07][INFO] Domain info updated with timeslice 22
[275992:internal-dpl-injected-dummy-sink]: [11:00:07][INFO] Domain info updated with timeslice 23
[275992:internal-dpl-injected-dummy-sink]: [11:00:07][INFO] Domain info updated with timeslice 24
[275992:internal-dpl-injected-dummy-sink]: [11:00:07][INFO] Domain info updated with timeslice 25
[275992:internal-dpl-injected-dummy-sink]: [11:00:07][INFO] Domain info updated with timeslice 26
[275992:internal-dpl-injected-dummy-sink]: [11:00:07][INFO] Domain info updated with timeslice 27
[275992:internal-dpl-injected-dummy-sink]: [11:00:07][INFO] Domain info updated with timeslice 28
[275992:internal-dpl-injected-dummy-sink]: [11:00:07][INFO] Domain info updated with timeslice 29
[275992:internal-dpl-injected-dummy-sink]: [11:00:07][INFO] Domain info updated with timeslice 30
[275992:internal-dpl-injected-dummy-sink]: [11:00:07][INFO] Domain info updated with timeslice 31
[275992:internal-dpl-injected-dummy-sink]: [11:00:07][INFO] Domain info updated with timeslice 32
[275992:internal-dpl-injected-dummy-sink]: [11:00:07][INFO] Domain info updated with timeslice 33
[275992:internal-dpl-injected-dummy-sink]: [11:00:07][INFO] Domain info updated with timeslice 34
[275992:internal-dpl-injected-dummy-sink]: [11:00:07][INFO] Domain info updated with timeslice 35
[275992:internal-dpl-injected-dummy-sink]: [11:00:07][INFO] Domain info updated with timeslice 36
[275992:internal-dpl-injected-dummy-sink]: [11:00:07][INFO] Domain info updated with timeslice 37
[275992:internal-dpl-injected-dummy-sink]: [11:00:07][INFO] Domain info updated with timeslice 38
[275992:internal-dpl-injected-dummy-sink]: [11:00:07][INFO] Domain info updated with timeslice 39
[275992:internal-dpl-injected-dummy-sink]: [11:00:07][INFO] Domain info updated with timeslice 40
[275992:internal-dpl-injected-dummy-sink]: [11:00:07][INFO] Domain info updated with timeslice 41
[275992:internal-dpl-injected-dummy-sink]: [11:00:07][INFO] Domain info updated with timeslice 42
[275992:internal-dpl-injected-dummy-sink]: [11:00:07][INFO] Domain info updated with timeslice 43
[275992:internal-dpl-injected-dummy-sink]: [11:00:07][INFO] Domain info updated with timeslice 44
[275992:internal-dpl-injected-dummy-sink]: [11:00:07][INFO] Domain info updated with timeslice 45
[275992:internal-dpl-injected-dummy-sink]: [11:00:07][INFO] Domain info updated with timeslice 46
[275992:internal-dpl-injected-dummy-sink]: [11:00:07][INFO] Domain info updated with timeslice 47
[275992:internal-dpl-injected-dummy-sink]: [11:00:07][INFO] Domain info updated with timeslice 48
[275992:internal-dpl-injected-dummy-sink]: [11:00:07][INFO] Domain info updated with timeslice 49
[275992:internal-dpl-injected-dummy-sink]: [11:00:07][INFO] Domain info updated with timeslice 50
[275992:internal-dpl-injected-dummy-sink]: [11:00:07][INFO] Domain info updated with timeslice 51
[275992:internal-dpl-injected-dummy-sink]: [11:00:07][INFO] Domain info updated with timeslice 52
[275992:internal-dpl-injected-dummy-sink]: [11:00:07][INFO] Domain info updated with timeslice 53
[275992:internal-dpl-injected-dummy-sink]: [11:00:07][INFO] Domain info updated with timeslice 54
[275992:internal-dpl-injected-dummy-sink]: [11:00:07][INFO] Domain info updated with timeslice 55
[275992:internal-dpl-injected-dummy-sink]: [11:00:07][INFO] Domain info updated with timeslice 56
[275992:internal-dpl-injected-dummy-sink]: [11:00:07][INFO] Domain info updated with timeslice 57
[275992:internal-dpl-injected-dummy-sink]: [11:00:07][INFO] Domain info updated with timeslice 58
[275992:internal-dpl-injected-dummy-sink]: [11:00:07][INFO] Domain info updated with timeslice 59
[275992:internal-dpl-injected-dummy-sink]: [11:00:07][INFO] Domain info updated with timeslice 60
[275992:internal-dpl-injected-dummy-sink]: [11:00:07][INFO] Domain info updated with timeslice 61
[275992:internal-dpl-injected-dummy-sink]: [11:00:07][INFO] Domain info updated with timeslice 62
[275992:internal-dpl-injected-dummy-sink]: [11:00:07][INFO] Domain info updated with timeslice 63
[275992:internal-dpl-injected-dummy-sink]: [11:00:07][INFO] Domain info updated with timeslice 64
[275992:internal-dpl-injected-dummy-sink]: [11:00:07][INFO] Domain info updated with timeslice 65
[275992:internal-dpl-injected-dummy-sink]: [11:00:07][INFO] Domain info updated with timeslice 66
[275992:internal-dpl-injected-dummy-sink]: [11:00:07][INFO] Domain info updated with timeslice 67
[275992:internal-dpl-injected-dummy-sink]: [11:00:07][INFO] Domain info updated with timeslice 68
[275992:internal-dpl-injected-dummy-sink]: [11:00:07][INFO] Domain info updated with timeslice 69
[275992:internal-dpl-injected-dummy-sink]: [11:00:07][INFO] Domain info updated with timeslice 70
[275992:internal-dpl-injected-dummy-sink]: [11:00:07][INFO] Domain info updated with timeslice 71
[275992:internal-dpl-injected-dummy-sink]: [11:00:07][INFO] Domain info updated with timeslice 72
[275992:internal-dpl-injected-dummy-sink]: [11:00:07][INFO] Domain info updated with timeslice 73
[275992:internal-dpl-injected-dummy-sink]: [11:00:07][INFO] Domain info updated with timeslice 74
[275992:internal-dpl-injected-dummy-sink]: [11:00:07][INFO] Domain info updated with timeslice 75
[275992:internal-dpl-injected-dummy-sink]: [11:00:07][INFO] Domain info updated with timeslice 76
[275992:internal-dpl-injected-dummy-sink]: [11:00:07][INFO] Domain info updated with timeslice 77
[275992:internal-dpl-injected-dummy-sink]: [11:00:07][INFO] Domain info updated with timeslice 78
[275992:internal-dpl-injected-dummy-sink]: [11:00:07][INFO] Domain info updated with timeslice 79
[275992:internal-dpl-injected-dummy-sink]: [11:00:07][INFO] Domain info updated with timeslice 80
[275992:internal-dpl-injected-dummy-sink]: [11:00:07][INFO] Domain info updated with timeslice 81
[275992:internal-dpl-injected-dummy-sink]: [11:00:07][INFO] Domain info updated with timeslice 82
[275992:internal-dpl-injected-dummy-sink]: [11:00:07][INFO] Domain info updated with timeslice 83
[275992:internal-dpl-injected-dummy-sink]: [11:00:07][INFO] Domain info updated with timeslice 84
[275992:internal-dpl-injected-dummy-sink]: [11:00:07][INFO] Domain info updated with timeslice 85
[275992:internal-dpl-injected-dummy-sink]: [11:00:07][INFO] Domain info updated with timeslice 86
[275992:internal-dpl-injected-dummy-sink]: [11:00:07][INFO] Domain info updated with timeslice 87
[275992:internal-dpl-injected-dummy-sink]: [11:00:07][INFO] Domain info updated with timeslice 88
[275992:internal-dpl-injected-dummy-sink]: [11:00:07][INFO] Domain info updated with timeslice 89
[275992:internal-dpl-injected-dummy-sink]: [11:00:07][INFO] Domain info updated with timeslice 90
[275992:internal-dpl-injected-dummy-sink]: [11:00:07][INFO] Domain info updated with timeslice 91
[275992:internal-dpl-injected-dummy-sink]: [11:00:07][INFO] Domain info updated with timeslice 92
[275992:internal-dpl-injected-dummy-sink]: [11:00:07][INFO] Domain info updated with timeslice 93
[275992:internal-dpl-injected-dummy-sink]: [11:00:07][INFO] Domain info updated with timeslice 94
[275992:internal-dpl-injected-dummy-sink]: [11:00:07][INFO] Domain info updated with timeslice 95
[275992:internal-dpl-injected-dummy-sink]: [11:00:07][INFO] Domain info updated with timeslice 96
[275992:internal-dpl-injected-dummy-sink]: [11:00:07][INFO] Domain info updated with timeslice 97
[275992:internal-dpl-injected-dummy-sink]: [11:00:07][INFO] Domain info updated with timeslice 98
[275992:internal-dpl-injected-dummy-sink]: [11:00:07][INFO] Domain info updated with timeslice 99
[275992:internal-dpl-injected-dummy-sink]: [11:00:07][INFO] Domain info updated with timeslice 100
[275989:internal-dpl-aod-reader]: [11:00:07][INFO] No input files left to read for reader 0!
[275989:internal-dpl-aod-reader]: [11:00:07][INFO] Read info: lfn=/home/cicero/O2Tutorial_2025/AO2D.root,size=57000273,total_df=100,read_df=100,read_bytes=10533154,read_calls=1104,io_time=0.4,wait_time=0.3,level=0
[275989:internal-dpl-aod-reader]: [11:00:07][INFO] Sending end-of-stream message to channel from_internal-dpl-aod-reader_to_strangeness_derived_tutorial
[275989:internal-dpl-aod-reader]: [11:00:07][INFO] Sending end-of-stream message to channel from_internal-dpl-aod-reader_to_internal-dpl-injected-dummy-sink
[275992:internal-dpl-injected-dummy-sink]: [11:00:07][INFO] Domain info updated with timeslice 101
[275990:strangeness_derived_tutorial]: [11:00:08][INFO] Sending end-of-stream message to channel from_strangeness_derived_tutorial_to_internal-dpl-aod-global-analysis-file-sink
[275991:internal-dpl-aod-global-analysis-file-sink]: Error in <Merge>: Cannot merge histograms - limits are inconsistent:
[275991:internal-dpl-aod-global-analysis-file-sink]:  first: hCascCosPA (100, 0.950000, 1.000000), second: hCascDCAV0Daughters (55, 0.000000, 2.200000)
[INFO] Quitting
[INFO] Quit requested at Wed Nov 12 11:00:08 2025

[275989:internal-dpl-aod-reader]: [11:00:08][INFO] Received device shutdown request (signal 15).
[275989:internal-dpl-aod-reader]: [11:00:08][INFO] Waiting for graceful device shutdown. Hit Ctrl-C again to abort immediately.
[275989:internal-dpl-aod-reader]: [11:00:08][INFO] New state requested. No timeout set, quitting immediately as per --completion-policy
[275989:internal-dpl-aod-reader]: [11:00:08][STATE] RUNNING ---> READY
[275989:internal-dpl-aod-reader]: [11:00:08][STATE] READY ---> RESETTING TASK
[275989:internal-dpl-aod-reader]: [11:00:08][STATE] RESETTING TASK ---> DEVICE READY
[275989:internal-dpl-aod-reader]: [11:00:08][STATE] DEVICE READY ---> RESETTING DEVICE
[275990:strangeness_derived_tutorial]: [11:00:08][INFO] Received device shutdown request (signal 15).
[275990:strangeness_derived_tutorial]: [11:00:08][INFO] Waiting for graceful device shutdown. Hit Ctrl-C again to abort immediately.
[275990:strangeness_derived_tutorial]: [11:00:08][INFO] New state requested. No timeout set, quitting immediately as per --completion-policy
[275990:strangeness_derived_tutorial]: [11:00:08][STATE] RUNNING ---> READY
[275990:strangeness_derived_tutorial]: [11:00:08][STATE] READY ---> RESETTING TASK
[275990:strangeness_derived_tutorial]: [11:00:08][STATE] RESETTING TASK ---> DEVICE READY
[275990:strangeness_derived_tutorial]: [11:00:08][STATE] DEVICE READY ---> RESETTING DEVICE
[275989:internal-dpl-aod-reader]: [11:00:08][STATE] RESETTING DEVICE ---> IDLE
[275989:internal-dpl-aod-reader]: [11:00:08][STATE] IDLE ---> EXITING
[275989:internal-dpl-aod-reader]: [11:00:08][STATE] Exiting FairMQ state machine
[275991:internal-dpl-aod-global-analysis-file-sink]: [11:00:08][INFO] Received device shutdown request (signal 15).
[275991:internal-dpl-aod-global-analysis-file-sink]: [11:00:08][INFO] Waiting for graceful device shutdown. Hit Ctrl-C again to abort immediately.
[275991:internal-dpl-aod-global-analysis-file-sink]: [11:00:08][INFO] New state requested. No timeout set, quitting immediately as per --completion-policy
[275991:internal-dpl-aod-global-analysis-file-sink]: [11:00:08][STATE] RUNNING ---> READY
[275991:internal-dpl-aod-global-analysis-file-sink]: [11:00:08][STATE] READY ---> RESETTING TASK
[275991:internal-dpl-aod-global-analysis-file-sink]: [11:00:08][STATE] RESETTING TASK ---> DEVICE READY
[275991:internal-dpl-aod-global-analysis-file-sink]: [11:00:08][STATE] DEVICE READY ---> RESETTING DEVICE
[275990:strangeness_derived_tutorial]: [11:00:08][STATE] RESETTING DEVICE ---> IDLE
[275990:strangeness_derived_tutorial]: [11:00:08][STATE] IDLE ---> EXITING
[275988:internal-dpl-clock]: [11:00:08][INFO] Received device shutdown request (signal 15).
[275988:internal-dpl-clock]: [11:00:08][INFO] Waiting for graceful device shutdown. Hit Ctrl-C again to abort immediately.
[275988:internal-dpl-clock]: [11:00:08][INFO] New state requested. No timeout set, quitting immediately as per --completion-policy
[275991:internal-dpl-aod-global-analysis-file-sink]: [11:00:08][STATE] RESETTING DEVICE ---> IDLE
[275991:internal-dpl-aod-global-analysis-file-sink]: [11:00:08][STATE] IDLE ---> EXITING
[275990:strangeness_derived_tutorial]: [11:00:08][STATE] Exiting FairMQ state machine
[275991:internal-dpl-aod-global-analysis-file-sink]: [11:00:08][STATE] Exiting FairMQ state machine
[275992:internal-dpl-injected-dummy-sink]: [11:00:08][INFO] Received device shutdown request (signal 15).
[275992:internal-dpl-injected-dummy-sink]: [11:00:08][INFO] Waiting for graceful device shutdown. Hit Ctrl-C again to abort immediately.
[275992:internal-dpl-injected-dummy-sink]: [11:00:08][INFO] New state requested. No timeout set, quitting immediately as per --completion-policy
[275992:internal-dpl-injected-dummy-sink]: [11:00:08][STATE] RUNNING ---> READY
[275992:internal-dpl-injected-dummy-sink]: [11:00:08][STATE] READY ---> RESETTING TASK
[275992:internal-dpl-injected-dummy-sink]: [11:00:08][STATE] RESETTING TASK ---> DEVICE READY
[275992:internal-dpl-injected-dummy-sink]: [11:00:08][STATE] DEVICE READY ---> RESETTING DEVICE
[275992:internal-dpl-injected-dummy-sink]: [11:00:08][STATE] RESETTING DEVICE ---> IDLE
[275992:internal-dpl-injected-dummy-sink]: [11:00:08][STATE] IDLE ---> EXITING
[275992:internal-dpl-injected-dummy-sink]: [11:00:08][STATE] Exiting FairMQ state machine
[275988:internal-dpl-clock]: [11:00:08][INFO] Sending end-of-stream message to channel from_internal-dpl-clock_to_internal-dpl-aod-reader
[275988:internal-dpl-clock]: [11:00:08][STATE] RUNNING ---> READY
[275988:internal-dpl-clock]: [11:00:08][STATE] READY ---> RESETTING TASK
[275988:internal-dpl-clock]: [11:00:08][STATE] RESETTING TASK ---> DEVICE READY
[275988:internal-dpl-clock]: [11:00:08][STATE] DEVICE READY ---> RESETTING DEVICE
[275988:internal-dpl-clock]: [11:00:08][INFO] Cleaning up for shared memory id 'f10775bb'...
[275988:internal-dpl-clock]: [11:00:08][INFO] Found 0 unmanaged regions...
[275988:internal-dpl-clock]: [11:00:08][INFO] Found 1 managed segments...
[275988:internal-dpl-clock]: [11:00:08][INFO] Successfully removed 'fmq_f10775bb_m_0'.
[275988:internal-dpl-clock]: [11:00:08][INFO] Successfully removed 'fmq_f10775bb_mng'.
[275988:internal-dpl-clock]: [11:00:08][STATE] RESETTING DEVICE ---> IDLE
[275988:internal-dpl-clock]: [11:00:08][STATE] IDLE ---> EXITING
[275988:internal-dpl-clock]: [11:00:08][STATE] Exiting FairMQ state machine
[INFO] ## Processes completed. Run summary:
[INFO] ### Devices started: 5
[INFO]  - Device internal-dpl-clock: pid 275988 (exit 0)
[INFO]  - Device internal-dpl-aod-reader: pid 275989 (exit 0)
[INFO]  - Device strangeness_derived_tutorial: pid 275990 (exit 0)
[INFO]  - Device internal-dpl-aod-global-analysis-file-sink: pid 275991 (exit 0)
[INFO]  - Device internal-dpl-injected-dummy-sink: pid 275992 (exit 0)
[INFO] ## Analysis Run Summary ##
[INFO] ### Files read stats ###
[INFO] lfn=/home/cicero/O2Tutorial_2025/AO2D.root,size=57000273,total_df=100,read_df=100,read_bytes=10533154,read_calls=1104,io_time=0.4,wait_time=0.3,level=0
[INFO] ### Files opened stats ###
[INFO] Last file opened: lfn=/home/cicero/O2Tutorial_2025/AO2D.root,size=57000273
[INFO] Dumping used configuration in dpl-config.json
